symbol,isin,trade_date,exchange,segment,series,trade_type,auction,quantity,price,trade_id,order_id,order_execution_time
CENTURYTEX,INE055A01016,4/1/2021,NSE,EQ,EQ,buy,FALSE,3,463,657321,1.00E+15,2021-04-01T09:49:57
ASHOKLEY,INE208A01029,4/1/2021,NSE,EQ,EQ,buy,FALSE,5,114.099998,664373,1.00E+15,2021-04-01T09:50:31
M&MFIN,INE774D01024,4/1/2021,NSE,EQ,EQ,buy,FALSE,3,201.300003,50680196,1.20E+15,2021-04-01T09:51:26
TATAPOWER,INE245A01021,4/1/2021,NSE,EQ,EQ,buy,FALSE,8,104,75784140,1.30E+15,2021-04-01T09:51:58
TRIDENT,INE064C01022,4/1/2021,NSE,EQ,EQ,buy,FALSE,10,14.15,75872469,1.30E+15,2021-04-01T09:58:34
TRIDENT,INE064C01022,4/1/2021,NSE,EQ,EQ,buy,FALSE,4,14.15,75874683,1.30E+15,2021-04-01T09:58:47
ONGC,INE213A01029,4/1/2021,NSE,EQ,EQ,buy,FALSE,5,102.849998,50775302,1.20E+15,2021-04-01T09:59:54
IDFCFIRSTB,INE092T01019,4/1/2021,NSE,EQ,EQ,buy,FALSE,5,57.5,26299553,1.10E+15,2021-04-01T10:22:55
CENTURYTEX,INE055A01016,4/5/2021,NSE,EQ,EQ,buy,FALSE,10,446.799988,5010418,1.00E+15,2021-04-05T15:27:26
ALKALI,INE773I01017,4/7/2021,NSE,EQ,EQ,buy,FALSE,13,58.549999,5871193,1.00E+15,2021-04-07T15:05:17
ALKALI,INE773I01017,4/7/2021,NSE,EQ,EQ,buy,FALSE,7,58.549999,5871194,1.00E+15,2021-04-07T15:05:17
KOLTEPATIL,INE094I01018,4/7/2021,NSE,EQ,EQ,buy,FALSE,3,243.100006,53773654,1.20E+15,2021-04-07T15:13:42
ONGC,INE213A01029,4/7/2021,NSE,EQ,EQ,buy,FALSE,2,104.800003,53879048,1.20E+15,2021-04-07T15:19:20
DABUR,INE016A01026,4/8/2021,NSE,EQ,EQ,sell,FALSE,1,555.5,2493494,1.00E+15,2021-04-08T11:43:21
HINDZINC,INE267A01025,4/8/2021,BSE,EQ,A,sell,FALSE,5,307.649994,2231900,1.62E+18,2021-04-08T11:50:15
SCI,INE109A01011,4/8/2021,BSE,EQ,A,buy,FALSE,5,114,2504100,1.62E+18,2021-04-08T11:51:35
XELPMOC,INE01P501012,4/8/2021,NSE,EQ,EQ,sell,FALSE,40,312.700012,78311849,1.30E+15,2021-04-08T13:05:55
DAAWAT,INE818H01020,4/8/2021,BSE,EQ,A,sell,FALSE,30,65.650002,63382300,1.62E+18,2021-04-08T15:42:34
CENTURYTEX,INE055A01016,4/9/2021,NSE,EQ,EQ,sell,FALSE,20,500,2552875,1.00E+15,2021-04-09T11:30:51
IDFCFIRSTB,INE092T01019,4/9/2021,NSE,EQ,EQ,buy,FALSE,25,56.200001,27622189,1.10E+15,2021-04-09T12:14:00
IDFCFIRSTB,INE092T01019,4/12/2021,BSE,EQ,A,buy,FALSE,25,51.950001,4628600,1.62E+18,2021-04-12T09:43:58
KRBL,INE001B01026,4/12/2021,NSE,EQ,EQ,buy,FALSE,10,183.25,51062772,1.20E+15,2021-04-12T09:46:50
AMARAJABAT,INE885A01032,4/12/2021,NSE,EQ,EQ,buy,FALSE,5,802.650024,1579336,1.00E+15,2021-04-12T09:50:47
ASHOKLEY,INE208A01029,4/12/2021,BSE,EQ,A,buy,FALSE,5,115.349998,4388000,1.62E+18,2021-04-12T09:56:34
KARURVYSYA,INE036D01028,4/12/2021,BSE,EQ,B,buy,FALSE,8,55.900002,624900,1.62E+18,2021-04-12T09:57:12
RAILTEL,INE0DD101019,4/12/2021,NSE,EQ,EQ,buy,FALSE,5,116.800003,76696988,1.30E+15,2021-04-12T09:57:31
COALINDIA,INE522F01014,4/12/2021,BSE,EQ,A,buy,FALSE,8,126,3660400,1.62E+18,2021-04-12T10:11:07
INDIGO,INE646L01027,4/12/2021,NSE,EQ,EQ,buy,FALSE,5,1569.75,27132257,1.10E+15,2021-04-12T10:28:11
ALKALI,INE773I01017,4/12/2021,BSE,EQ,B,buy,FALSE,10,53.450001,1426400,1.62E+18,2021-04-12T12:38:27
ALKALI,INE773I01017,4/12/2021,BSE,EQ,B,buy,FALSE,20,53.400002,1426200,1.62E+18,2021-04-12T12:38:27
ONGC,INE213A01029,4/12/2021,BSE,EQ,A,buy,FALSE,10,98.150002,8066900,1.62E+18,2021-04-12T12:40:11
INDIGO,INE646L01027,4/12/2021,NSE,EQ,EQ,buy,FALSE,2,1561,29397735,1.10E+15,2021-04-12T12:50:27
TATACONSUM,INE192A01025,4/12/2021,NSE,EQ,EQ,buy,FALSE,1,658.849976,80080946,1.30E+15,2021-04-12T12:54:58
IDFCFIRSTB,INE092T01019,4/13/2021,NSE,EQ,EQ,buy,FALSE,9,52.099998,25802261,1.10E+15,2021-04-13T09:44:45
IDFCFIRSTB,INE092T01019,4/13/2021,NSE,EQ,EQ,buy,FALSE,11,52.400002,25914695,1.10E+15,2021-04-13T09:51:07
IDFCFIRSTB,INE092T01019,4/13/2021,NSE,EQ,EQ,buy,FALSE,5,52.400002,25924217,1.10E+15,2021-04-13T09:51:38
TATAMOTORS,INE155A01022,4/13/2021,BSE,EQ,A,buy,FALSE,5,289.200012,4097800,1.62E+18,2021-04-13T09:52:42
SPICEJET,INE285B01017,4/13/2021,NSE,EQ,EQ,buy,FALSE,10,68.300003,76141140,1.30E+15,2021-04-13T09:52:53
M&M,INE101A01026,4/13/2021,NSE,EQ,EQ,buy,FALSE,2,782,50859097,1.20E+15,2021-04-13T09:57:34
RAILTEL,INE0DD101019,4/13/2021,BSE,EQ,B,buy,FALSE,4,117.150002,2448600,1.62E+18,2021-04-13T10:07:41
CUPID,INE509F01011,4/15/2021,NSE,EQ,EQ,buy,FALSE,4,217.949997,1286483,1.00E+15,2021-04-15T09:59:01
CUPID,INE509F01011,4/15/2021,NSE,EQ,EQ,buy,FALSE,1,217.899994,1286482,1.00E+15,2021-04-15T09:59:01
MEGH,INE974H01013,4/15/2021,NSE,EQ,EQ,buy,FALSE,5,119.849998,51024530,1.20E+15,2021-04-15T09:59:44
WIPRO,INE075A01022,4/15/2021,NSE,EQ,EQ,buy,FALSE,1,431.799988,76295823,1.30E+15,2021-04-15T10:00:13
TATAPOWER,INE245A01021,4/15/2021,NSE,EQ,EQ,buy,FALSE,4,93.849998,76901599,1.30E+15,2021-04-15T10:40:38
MOTHERSUMI,INE775A01035,4/16/2021,NSE,EQ,EQ,buy,FALSE,5,209.449997,50002669,1.20E+15,2021-04-16T09:07:04
MOTHERSUMI,INE775A01035,4/16/2021,NSE,EQ,EQ,buy,FALSE,5,208.5,50662338,1.20E+15,2021-04-16T09:51:43
ONGC,INE213A01029,4/16/2021,BSE,EQ,A,buy,FALSE,8,106.550003,976800,1.62E+18,2021-04-16T10:05:36
EXIDEIND,INE302A01020,4/16/2021,BSE,EQ,A,buy,FALSE,5,177.649994,1132300,1.62E+18,2021-04-16T10:06:22
M&MFIN,INE774D01024,4/16/2021,BSE,EQ,A,buy,FALSE,3,173.649994,1094300,1.62E+18,2021-04-16T10:10:01
VIMTALABS,INE579C01029,4/16/2021,NSE,EQ,EQ,buy,FALSE,3,204.5,76348730,1.30E+15,2021-04-16T10:10:48
IRFC,INE053F01010,4/16/2021,NSE,EQ,EQ,buy,FALSE,3,21.700001,27018380,1.10E+15,2021-04-16T12:02:05
HINDZINC,INE267A01025,4/19/2021,NSE,EQ,EQ,buy,FALSE,10,280.600006,26962271,1.10E+15,2021-04-19T10:44:47
IDFCFIRSTB,INE092T01019,4/19/2021,NSE,EQ,EQ,buy,FALSE,3,50.900002,27244384,1.10E+15,2021-04-19T11:11:58
ASHOKLEY,INE208A01029,4/20/2021,NSE,EQ,EQ,buy,FALSE,10,113.449997,1573154,1.00E+15,2021-04-20T10:20:43
IDFCFIRSTB,INE092T01019,4/20/2021,NSE,EQ,EQ,buy,FALSE,47,51.950001,26344088,1.10E+15,2021-04-20T10:21:29
M&MFIN,INE774D01024,4/20/2021,NSE,EQ,EQ,buy,FALSE,4,172.899994,51090812,1.20E+15,2021-04-20T10:23:03
ITC,INE154A01025,4/20/2021,NSE,EQ,EQ,buy,FALSE,19,206,26619468,1.10E+15,2021-04-20T10:45:07
INDIGO,INE646L01027,4/20/2021,NSE,EQ,EQ,buy,FALSE,3,1548.800049,26631112,1.10E+15,2021-04-20T10:46:19
M&MFIN,INE774D01024,4/20/2021,NSE,EQ,EQ,buy,FALSE,10,175.149994,51294594,1.20E+15,2021-04-20T10:47:17
ASHOKLEY,INE208A01029,4/20/2021,NSE,EQ,EQ,buy,FALSE,4,112.900002,1886478,1.00E+15,2021-04-20T10:47:57
MOTHERSUMI,INE775A01035,4/20/2021,NSE,EQ,EQ,buy,FALSE,10,206.300003,51469473,1.20E+15,2021-04-20T11:09:44
SPICEJET,INE285B01017,4/20/2021,NSE,EQ,EQ,buy,FALSE,15,62.400002,76889074,1.30E+15,2021-04-20T11:20:40
AMARAJABAT,INE885A01032,4/20/2021,BSE,EQ,A,buy,FALSE,2,807.900024,2181200,1.62E+18,2021-04-20T11:40:21
TATAPOWER,INE245A01021,4/20/2021,NSE,EQ,EQ,buy,FALSE,3,94.75,77169736,1.30E+15,2021-04-20T11:50:57
CENTURYTEX,INE055A01016,4/20/2021,NSE,EQ,EQ,buy,FALSE,1,449.450012,3037437,1.00E+15,2021-04-20T12:37:37
CENTURYTEX,INE055A01016,4/20/2021,NSE,EQ,EQ,buy,FALSE,1,449.450012,3037438,1.00E+15,2021-04-20T12:37:37
CENTURYTEX,INE055A01016,4/20/2021,NSE,EQ,EQ,buy,FALSE,4,449.649994,3037439,1.00E+15,2021-04-20T12:37:37
CENTURYTEX,INE055A01016,4/20/2021,NSE,EQ,EQ,buy,FALSE,4,449.700012,3037440,1.00E+15,2021-04-20T12:37:37
RAILTEL,INE0DD101019,4/20/2021,NSE,EQ,EQ,buy,FALSE,5,111.150002,77737416,1.30E+15,2021-04-20T12:46:32
MAHABANK,INE457A01014,4/20/2021,BSE,EQ,A,buy,FALSE,2,22.950001,29876400,1.62E+18,2021-04-20T12:58:54
CENTURYTEX,INE055A01016,4/22/2021,BSE,EQ,A,buy,FALSE,10,444.850006,259200,1.62E+18,2021-04-22T09:23:20
XELPMOC,INE01P501012,4/22/2021,NSE,EQ,EQ,buy,FALSE,1,282.799988,75661234,1.30E+15,2021-04-22T09:31:22
CUPID,INE509F01011,4/22/2021,NSE,EQ,EQ,buy,FALSE,1,214.350006,771794,1.00E+15,2021-04-22T09:36:35
ASHOKLEY,INE208A01029,4/22/2021,BSE,EQ,A,buy,FALSE,6,113.5,4158600,1.62E+18,2021-04-22T11:50:50
AMARAJABAT,INE885A01032,4/23/2021,NSE,EQ,EQ,buy,FALSE,1,802.75,1287886,1.00E+15,2021-04-23T10:18:46
XELPMOC,INE01P501012,4/23/2021,BSE,EQ,B,buy,FALSE,2,283.549988,10622300,1.62E+18,2021-04-23T10:20:39
XELPMOC,INE01P501012,4/23/2021,BSE,EQ,B,buy,FALSE,1,278.549988,12138300,1.62E+18,2021-04-23T10:43:12
IDFCFIRSTB,INE092T01019,4/23/2021,NSE,EQ,EQ,buy,FALSE,3,52.25,26494009,1.10E+15,2021-04-23T10:44:21
WIPRO,INE075A01022,4/23/2021,NSE,EQ,EQ,sell,FALSE,1,483.100006,78224680,1.30E+15,2021-04-23T13:15:36
IDFCFIRSTB,INE092T01019,4/26/2021,NSE,EQ,EQ,buy,FALSE,7,52.299999,27617378,1.10E+15,2021-04-26T12:12:03
OIL,INE274J01014,4/26/2021,NSE,EQ,EQ,buy,FALSE,1,116.300003,52138362,1.20E+15,2021-04-26T12:15:59
VIMTALABS,INE579C01029,4/27/2021,BSE,EQ,B,sell,FALSE,3,282.649994,18329200,1.62E+18,2021-04-27T12:18:05
IDFCFIRSTB,INE092T01019,4/27/2021,NSE,EQ,EQ,buy,FALSE,10,53.450001,27637465,1.10E+15,2021-04-27T12:20:53
RAILTEL,INE0DD101019,4/28/2021,NSE,EQ,EQ,buy,FALSE,1,124.25,75960314,1.30E+15,2021-04-28T09:47:16
TATAPOWER,INE245A01021,4/28/2021,NSE,EQ,EQ,buy,FALSE,1,98.550003,76012622,1.30E+15,2021-04-28T09:49:56
IDFCFIRSTB,INE092T01019,4/28/2021,NSE,EQ,EQ,buy,FALSE,1,54.150002,25982565,1.10E+15,2021-04-28T09:59:31
CENTURYTEX,INE055A01016,4/29/2021,BSE,EQ,A,sell,FALSE,9,495,265100,1.62E+18,2021-04-29T09:20:15
CENTURYTEX,INE055A01016,4/29/2021,BSE,EQ,A,sell,FALSE,11,495,265300,1.62E+18,2021-04-29T09:20:15
M&M,INE101A01026,4/29/2021,BSE,EQ,A,buy,FALSE,3,774.099976,2141100,1.62E+18,2021-04-29T11:56:23
TATAMOTORS,INE155A01022,4/29/2021,NSE,EQ,EQ,buy,FALSE,5,304.850006,77753755,1.30E+15,2021-04-29T11:57:23
TATAPOWER,INE245A01021,4/29/2021,BSE,EQ,A,buy,FALSE,2,98.75,3186500,1.62E+18,2021-04-29T11:59:04
CUPID,INE509F01011,4/29/2021,NSE,EQ,EQ,buy,FALSE,4,219.5,2771388,1.00E+15,2021-04-29T12:00:40
VIMTALABS,INE579C01029,4/29/2021,NSE,EQ,EQ,buy,FALSE,2,254.5,77798920,1.30E+15,2021-04-29T12:01:57
VIMTALABS,INE579C01029,4/29/2021,NSE,EQ,EQ,buy,FALSE,8,254.449997,77798919,1.30E+15,2021-04-29T12:01:57
IDFCFIRSTB,INE092T01019,4/29/2021,NSE,EQ,EQ,buy,FALSE,4,54.599998,27527198,1.10E+15,2021-04-29T12:05:02
ITC,INE154A01025,4/29/2021,BSE,EQ,A,buy,FALSE,1,205.100006,3593500,1.62E+18,2021-04-29T12:10:50
TATAPOWER,INE245A01021,4/30/2021,BSE,EQ,A,buy,FALSE,5,98.400002,882800,1.62E+18,2021-04-30T09:40:33
TATAMOTORS,INE155A01022,4/30/2021,NSE,EQ,EQ,buy,FALSE,5,299.049988,76032609,1.30E+15,2021-04-30T09:40:59
VIMTALABS,INE579C01029,4/30/2021,NSE,EQ,EQ,buy,FALSE,1,257.850006,79364016,1.30E+15,2021-04-30T14:03:41
VIMTALABS,INE579C01029,4/30/2021,NSE,EQ,EQ,buy,FALSE,8,257.75,79364014,1.30E+15,2021-04-30T14:03:41
VIMTALABS,INE579C01029,4/30/2021,NSE,EQ,EQ,buy,FALSE,1,257.799988,79364015,1.30E+15,2021-04-30T14:03:41
AMARAJABAT,INE885A01032,4/30/2021,BSE,EQ,A,buy,FALSE,3,811.549988,3445900,1.62E+18,2021-04-30T14:04:03
IDFCFIRSTB,INE092T01019,5/3/2021,NSE,EQ,EQ,buy,FALSE,5,53.650002,27291730,1.10E+15,2021-05-03T11:47:04
ALKALI,INE773I01017,5/3/2021,NSE,EQ,EQ,sell,FALSE,1,57.349998,2829529,1.00E+15,2021-05-03T12:00:52
ALKALI,INE773I01017,5/3/2021,NSE,EQ,EQ,sell,FALSE,49,57.349998,2836980,1.00E+15,2021-05-03T12:01:27
TATAMOTORS,INE155A01022,5/3/2021,BSE,EQ,A,buy,FALSE,5,291.799988,7209700,1.62E+18,2021-05-03T12:09:57
MEGH,INE974H01013,5/3/2021,NSE,EQ,EQ,sell,FALSE,5,151,52484762,1.20E+15,2021-05-03T12:12:35
EXIDEIND,INE302A01020,5/3/2021,NSE,EQ,EQ,buy,FALSE,5,182.350006,27627023,1.10E+15,2021-05-03T12:20:38
AMARAJABAT,INE885A01032,5/3/2021,NSE,EQ,EQ,buy,FALSE,1,778.5,3124693,1.00E+15,2021-05-03T12:22:38
EVEREADY,INE128A01029,5/3/2021,NSE,EQ,EQ,buy,FALSE,5,295.350006,27659752,1.10E+15,2021-05-03T12:23:46
ASHOKLEY,INE208A01029,5/3/2021,NSE,EQ,EQ,buy,FALSE,15,111.75,3185794,1.00E+15,2021-05-03T12:26:38
HBLPOWER,INE292B01021,5/3/2021,NSE,EQ,EQ,buy,FALSE,30,34.650002,27743377,1.10E+15,2021-05-03T12:31:40
M&MFIN,INE774D01024,5/3/2021,BSE,EQ,A,buy,FALSE,10,159.850006,4637600,1.62E+18,2021-05-03T12:37:29
DAAWAT,INE818H01020,5/4/2021,NSE,EQ,EQ,buy,FALSE,3,81.650002,1706006,1.00E+15,2021-05-04T10:23:39
DAAWAT,INE818H01020,5/4/2021,NSE,EQ,EQ,buy,FALSE,2,81.699997,1783058,1.00E+15,2021-05-04T10:29:03
DAAWAT,INE818H01020,5/4/2021,NSE,EQ,EQ,buy,FALSE,5,81.800003,1785406,1.00E+15,2021-05-04T10:29:16
INDIGO,INE646L01027,5/4/2021,NSE,EQ,EQ,sell,FALSE,10,1662.800049,26527897,1.10E+15,2021-05-04T10:30:47
PFC,INE134E01011,5/4/2021,NSE,EQ,EQ,buy,FALSE,10,109.75,51624949,1.20E+15,2021-05-04T10:34:50
TATACHEM,INE092A01019,5/4/2021,NSE,EQ,EQ,buy,FALSE,10,723.799988,79663611,1.30E+15,2021-05-04T13:29:27
M&M,INE101A01026,5/4/2021,BSE,EQ,A,buy,FALSE,5,741.900024,4285200,1.62E+18,2021-05-04T14:20:04
VIMTALABS,INE579C01029,5/4/2021,BSE,EQ,B,buy,FALSE,1,243.300003,26601600,1.62E+18,2021-05-04T14:21:30
VIMTALABS,INE579C01029,5/4/2021,BSE,EQ,B,buy,FALSE,9,243.25,26601400,1.62E+18,2021-05-04T14:21:30
ASHOKLEY,INE208A01029,5/4/2021,BSE,EQ,A,buy,FALSE,3,112.349998,10366000,1.62E+18,2021-05-04T14:23:40
YESBANK,INE528G01035,5/4/2021,BSE,EQ,A,buy,FALSE,3,13.92,7842600,1.62E+18,2021-05-04T14:25:18
ASHOKLEY,INE208A01029,5/4/2021,NSE,EQ,EQ,buy,FALSE,5,110.849998,5267226,1.00E+15,2021-05-04T14:49:16
OIL,INE274J01014,5/4/2021,BSE,EQ,A,buy,FALSE,7,121.25,8659400,1.62E+18,2021-05-04T14:51:26
ITC,INE154A01025,5/4/2021,BSE,EQ,A,buy,FALSE,2,199.5,9479900,1.62E+18,2021-05-04T15:27:17
M&MFIN,INE774D01024,5/4/2021,NSE,EQ,EQ,buy,FALSE,1,155.449997,54882694,1.20E+15,2021-05-04T15:27:56
M&M,INE101A01026,5/5/2021,NSE,EQ,EQ,buy,FALSE,2,741,50548351,1.20E+15,2021-05-05T09:38:57
DAAWAT,INE818H01020,5/5/2021,BSE,EQ,A,buy,FALSE,10,77.599998,10705700,1.62E+18,2021-05-05T09:39:30
AMARAJABAT,INE885A01032,5/5/2021,BSE,EQ,A,buy,FALSE,1,776,562200,1.62E+18,2021-05-05T09:39:55
ASHOKLEY,INE208A01029,5/5/2021,BSE,EQ,A,buy,FALSE,2,110.5,1120400,1.62E+18,2021-05-05T09:40:18
ASHOKLEY,INE208A01029,5/5/2021,NSE,EQ,EQ,buy,FALSE,3,110.599998,1145805,1.00E+15,2021-05-05T09:54:52
ASHOKLEY,INE208A01029,5/5/2021,NSE,EQ,EQ,buy,FALSE,7,110.599998,1145806,1.00E+15,2021-05-05T09:54:52
M&MFIN,INE774D01024,5/5/2021,NSE,EQ,EQ,buy,FALSE,7,155.600006,50806004,1.20E+15,2021-05-05T09:55:14
M&MFIN,INE774D01024,5/5/2021,NSE,EQ,EQ,buy,FALSE,2,155.600006,50814527,1.20E+15,2021-05-05T09:55:50
HDFCLIFE,INE795G01014,5/5/2021,NSE,EQ,EQ,buy,FALSE,5,672.400024,25929849,1.10E+15,2021-05-05T09:59:15
ASHOKLEY,INE208A01029,5/5/2021,NSE,EQ,EQ,buy,FALSE,7,110.75,1242707,1.00E+15,2021-05-05T10:01:00
TATACONSUM,INE192A01025,5/5/2021,NSE,EQ,EQ,buy,FALSE,3,652.799988,76220181,1.30E+15,2021-05-05T10:02:55
EXIDEIND,INE302A01020,5/5/2021,NSE,EQ,EQ,buy,FALSE,5,181.5,26088534,1.10E+15,2021-05-05T10:07:41
ITC,INE154A01025,5/5/2021,NSE,EQ,EQ,buy,FALSE,2,199.949997,26143024,1.10E+15,2021-05-05T10:12:39
TATAPOWER,INE245A01021,5/5/2021,NSE,EQ,EQ,buy,FALSE,10,101.25,76527492,1.30E+15,2021-05-05T10:21:58
TATAMOTORS,INE155A01022,5/5/2021,NSE,EQ,EQ,buy,FALSE,10,289.899994,76530599,1.30E+15,2021-05-05T10:22:12
INFY,INE009A01021,5/5/2021,NSE,EQ,EQ,buy,FALSE,1,1332.449951,26283831,1.10E+15,2021-05-05T10:24:55
WIPRO,INE075A01022,5/5/2021,NSE,EQ,EQ,buy,FALSE,1,490,76575057,1.30E+15,2021-05-05T10:25:11
XELPMOC,INE01P501012,5/5/2021,NSE,EQ,EQ,buy,FALSE,1,282.700012,76587964,1.30E+15,2021-05-05T10:26:06
PFC,INE134E01011,5/5/2021,BSE,EQ,A,buy,FALSE,1,109.300003,1174100,1.62E+18,2021-05-05T10:36:10
CUPID,INE509F01011,5/5/2021,BSE,EQ,B,sell,FALSE,10,229.25,1423300,1.62E+18,2021-05-05T11:31:21
ASHOKLEY,INE208A01029,5/5/2021,BSE,EQ,A,buy,FALSE,8,111.050003,3830800,1.62E+18,2021-05-05T11:32:33
XELPMOC,INE01P501012,5/5/2021,NSE,EQ,EQ,buy,FALSE,3,281.549988,77424462,1.30E+15,2021-05-05T11:33:56
KRBL,INE001B01026,5/5/2021,NSE,EQ,EQ,sell,FALSE,5,207.699997,51964630,1.20E+15,2021-05-05T11:34:38
KRBL,INE001B01026,5/5/2021,NSE,EQ,EQ,sell,FALSE,15,207.699997,51964631,1.20E+15,2021-05-05T11:34:38
XELPMOC,INE01P501012,5/5/2021,NSE,EQ,EQ,buy,FALSE,1,281.299988,77449262,1.30E+15,2021-05-05T11:36:03
XELPMOC,INE01P501012,5/5/2021,NSE,EQ,EQ,buy,FALSE,1,281.25,77449261,1.30E+15,2021-05-05T11:36:03
HDFCLIFE,INE795G01014,5/5/2021,NSE,EQ,EQ,buy,FALSE,2,667.849976,27125295,1.10E+15,2021-05-05T11:45:45
HDFCLIFE,INE795G01014,5/5/2021,NSE,EQ,EQ,buy,FALSE,2,667.700012,27130567,1.10E+15,2021-05-05T11:46:23
HBLPOWER,INE292B01021,5/5/2021,BSE,EQ,B,buy,FALSE,5,35.049999,2604800,1.62E+18,2021-05-05T12:03:06
AMARAJABAT,INE885A01032,5/5/2021,BSE,EQ,A,sell,FALSE,13,768.799988,4352800,1.62E+18,2021-05-05T12:57:42
DABUR,INE016A01026,5/6/2021,NSE,EQ,EQ,buy,FALSE,10,543.049988,901775,1.00E+15,2021-05-06T09:41:47
M&M,INE101A01026,5/6/2021,NSE,EQ,EQ,buy,FALSE,3,755.75,50733184,1.20E+15,2021-05-06T09:45:13
HDFCLIFE,INE795G01014,5/6/2021,NSE,EQ,EQ,buy,FALSE,1,675,25932807,1.10E+15,2021-05-06T09:54:15
XELPMOC,INE01P501012,5/6/2021,NSE,EQ,EQ,buy,FALSE,5,280.450012,76388979,1.30E+15,2021-05-06T09:55:51
M&M,INE101A01026,5/6/2021,NSE,EQ,EQ,buy,FALSE,1,750,51064967,1.20E+15,2021-05-06T10:05:36
ITC,INE154A01025,5/6/2021,BSE,EQ,A,buy,FALSE,3,204.100006,2319700,1.62E+18,2021-05-06T10:07:20
MAHABANK,INE457A01014,5/6/2021,BSE,EQ,A,buy,FALSE,3,24.9,18759600,1.62E+18,2021-05-06T10:08:44
SPICEJET,INE285B01017,5/6/2021,NSE,EQ,EQ,buy,FALSE,10,62.799999,77233071,1.30E+15,2021-05-06T10:46:53
LUMAXTECH,INE872H01027,5/6/2021,NSE,EQ,EQ,buy,FALSE,1,139.25,54108963,1.20E+15,2021-05-06T14:58:32
LUMAXTECH,INE872H01027,5/6/2021,NSE,EQ,EQ,buy,FALSE,14,139.25,54108964,1.20E+15,2021-05-06T14:58:32
XELPMOC,INE01P501012,5/7/2021,NSE,EQ,EQ,sell,FALSE,1,302.049988,77460364,1.30E+15,2021-05-07T10:50:28
XELPMOC,INE01P501012,5/7/2021,NSE,EQ,EQ,sell,FALSE,1,302.299988,77460361,1.30E+15,2021-05-07T10:50:28
XELPMOC,INE01P501012,5/7/2021,NSE,EQ,EQ,sell,FALSE,1,302.200012,77460362,1.30E+15,2021-05-07T10:50:28
XELPMOC,INE01P501012,5/7/2021,NSE,EQ,EQ,sell,FALSE,1,302.100006,77460363,1.30E+15,2021-05-07T10:50:28
XELPMOC,INE01P501012,5/7/2021,NSE,EQ,EQ,sell,FALSE,1,302.600006,77460357,1.30E+15,2021-05-07T10:50:28
XELPMOC,INE01P501012,5/7/2021,NSE,EQ,EQ,sell,FALSE,1,302.299988,77460360,1.30E+15,2021-05-07T10:50:28
XELPMOC,INE01P501012,5/7/2021,NSE,EQ,EQ,sell,FALSE,1,302.399994,77460359,1.30E+15,2021-05-07T10:50:28
XELPMOC,INE01P501012,5/7/2021,NSE,EQ,EQ,sell,FALSE,1,303,77460354,1.30E+15,2021-05-07T10:50:28
XELPMOC,INE01P501012,5/7/2021,NSE,EQ,EQ,sell,FALSE,1,302.600006,77460356,1.30E+15,2021-05-07T10:50:28
XELPMOC,INE01P501012,5/7/2021,NSE,EQ,EQ,sell,FALSE,1,302.700012,77460355,1.30E+15,2021-05-07T10:50:28
XELPMOC,INE01P501012,5/7/2021,NSE,EQ,EQ,sell,FALSE,1,303.100006,77460351,1.30E+15,2021-05-07T10:50:28
XELPMOC,INE01P501012,5/7/2021,NSE,EQ,EQ,sell,FALSE,1,303.100006,77460350,1.30E+15,2021-05-07T10:50:28
XELPMOC,INE01P501012,5/7/2021,NSE,EQ,EQ,sell,FALSE,1,303.049988,77460353,1.30E+15,2021-05-07T10:50:28
XELPMOC,INE01P501012,5/7/2021,NSE,EQ,EQ,sell,FALSE,1,303.100006,77460352,1.30E+15,2021-05-07T10:50:28
XELPMOC,INE01P501012,5/7/2021,NSE,EQ,EQ,sell,FALSE,1,302.5,77460358,1.30E+15,2021-05-07T10:50:28
MOTHERSUMI,INE775A01035,5/7/2021,BSE,EQ,A,sell,FALSE,20,219.699997,1654400,1.62E+18,2021-05-07T10:52:36
WIPRO,INE075A01022,5/7/2021,BSE,EQ,A,sell,FALSE,1,512.950012,3577600,1.62E+18,2021-05-07T10:53:48
INFY,INE009A01021,5/7/2021,NSE,EQ,EQ,buy,FALSE,1,1361.650024,26968940,1.10E+15,2021-05-07T11:00:54
M&MFIN,INE774D01024,5/7/2021,BSE,EQ,A,buy,FALSE,5,154.75,3578500,1.62E+18,2021-05-07T12:16:06
TATACONSUM,INE192A01025,5/7/2021,BSE,EQ,A,buy,FALSE,2,626.150024,9595400,1.62E+18,2021-05-07T12:18:29
TATACHEM,INE092A01019,5/7/2021,NSE,EQ,EQ,buy,FALSE,2,685.400024,78810237,1.30E+15,2021-05-07T12:19:31
TATACHEM,INE092A01019,5/7/2021,NSE,EQ,EQ,buy,FALSE,1,685.5,78813351,1.30E+15,2021-05-07T12:19:52
TATACHEM,INE092A01019,5/7/2021,NSE,EQ,EQ,buy,FALSE,2,685.5,78813352,1.30E+15,2021-05-07T12:19:52
LUMAXTECH,INE872H01027,5/7/2021,BSE,EQ,B,buy,FALSE,5,138.5,2553000,1.62E+18,2021-05-07T12:31:19
DABUR,INE016A01026,5/7/2021,BSE,EQ,A,buy,FALSE,5,536.950012,5300700,1.62E+18,2021-05-07T12:53:01
LXCHEM,INE576O01020,5/10/2021,NSE,EQ,EQ,buy,FALSE,15,221.5,50054341,1.20E+15,2021-05-10T09:15:17
LXCHEM,INE576O01020,5/10/2021,NSE,EQ,EQ,buy,FALSE,5,221.449997,50054340,1.20E+15,2021-05-10T09:15:17
DABUR,INE016A01026,5/10/2021,BSE,EQ,A,buy,FALSE,3,526.450012,560000,1.62E+18,2021-05-10T09:19:36
IDFCFIRSTB,INE092T01019,5/10/2021,NSE,EQ,EQ,buy,FALSE,10,55.849998,25315580,1.10E+15,2021-05-10T09:20:30
TRIDENT,INE064C01022,5/10/2021,BSE,EQ,A,buy,FALSE,7,16.24,987100,1.62E+18,2021-05-10T09:23:16
LXCHEM,INE576O01020,5/10/2021,NSE,EQ,EQ,buy,FALSE,5,222.850006,50637497,1.20E+15,2021-05-10T09:29:06
IDFCFIRSTB,INE092T01019,5/10/2021,NSE,EQ,EQ,buy,FALSE,5,55.799999,26130157,1.10E+15,2021-05-10T09:51:38
DABUR,INE016A01026,5/10/2021,BSE,EQ,A,buy,FALSE,1,523,2853900,1.62E+18,2021-05-10T10:12:53
ITC,INE154A01025,5/10/2021,BSE,EQ,A,buy,FALSE,1,205.800003,2344800,1.62E+18,2021-05-10T10:14:28
LXCHEM,INE576O01020,5/10/2021,NSE,EQ,EQ,buy,FALSE,5,220.350006,51687667,1.20E+15,2021-05-10T10:22:22
IDFCFIRSTB,INE092T01019,5/10/2021,NSE,EQ,EQ,buy,FALSE,5,55.900002,27083376,1.10E+15,2021-05-10T10:51:04
HBLPOWER,INE292B01021,5/10/2021,NSE,EQ,EQ,buy,FALSE,15,35.400002,27540587,1.10E+15,2021-05-10T11:25:07
KOLTEPATIL,INE094I01018,5/10/2021,BSE,EQ,A,sell,FALSE,3,244.199997,49842300,1.62E+18,2021-05-10T12:01:01
DABUR,INE016A01026,5/10/2021,BSE,EQ,A,buy,FALSE,1,522.25,5519100,1.62E+18,2021-05-10T12:01:33
SAIL,INE114A01011,5/10/2021,BSE,EQ,A,buy,FALSE,1,147.75,5555700,1.62E+18,2021-05-10T12:04:06
PRAJIND,INE074A01025,5/10/2021,NSE,EQ,EQ,buy,FALSE,10,296.899994,53069612,1.20E+15,2021-05-10T12:23:16
PRAJIND,INE074A01025,5/10/2021,NSE,EQ,EQ,buy,FALSE,5,297.100006,53078877,1.20E+15,2021-05-10T12:24:12
SBIN,INE062A01020,5/10/2021,NSE,EQ,EQ,sell,FALSE,1,363.5,78547882,1.30E+15,2021-05-10T12:24:53
PRAJIND,INE074A01025,5/10/2021,NSE,EQ,EQ,buy,FALSE,2,297.100006,53087499,1.20E+15,2021-05-10T12:25:06
M&MFIN,INE774D01024,5/10/2021,BSE,EQ,A,buy,FALSE,1,156,4753100,1.62E+18,2021-05-10T12:29:16
TRIDENT,INE064C01022,5/10/2021,BSE,EQ,A,buy,FALSE,8,16.780001,6435600,1.62E+18,2021-05-10T12:52:49
PRAJIND,INE074A01025,5/10/2021,NSE,EQ,EQ,buy,FALSE,6,313.399994,53776532,1.20E+15,2021-05-10T13:27:26
PFC,INE134E01011,5/10/2021,NSE,EQ,EQ,sell,FALSE,11,112.849998,53806559,1.20E+15,2021-05-10T13:30:09
PRAJIND,INE074A01025,5/10/2021,NSE,EQ,EQ,buy,FALSE,3,313.399994,53812081,1.20E+15,2021-05-10T13:30:47
DAAWAT,INE818H01020,5/10/2021,BSE,EQ,A,sell,FALSE,20,76.75,66978300,1.62E+18,2021-05-10T13:32:07
PRAJIND,INE074A01025,5/10/2021,NSE,EQ,EQ,buy,FALSE,4,313.100006,53828213,1.20E+15,2021-05-10T13:32:30
SCI,INE109A01011,5/10/2021,NSE,EQ,EQ,sell,FALSE,10,116.5,79455210,1.30E+15,2021-05-10T13:33:51
KOTAKBANK,INE237A01028,5/10/2021,NSE,EQ,EQ,sell,FALSE,1,1805.050049,53852687,1.20E+15,2021-05-10T13:34:52
SAIL,INE114A01011,5/10/2021,BSE,EQ,A,sell,FALSE,1,145.75,6661100,1.62E+18,2021-05-10T13:35:20
MAHABANK,INE457A01014,5/10/2021,NSE,EQ,EQ,buy,FALSE,13,24.700001,53913267,1.20E+15,2021-05-10T13:40:34
PRAJIND,INE074A01025,5/10/2021,NSE,EQ,EQ,buy,FALSE,5,312.450012,54030920,1.20E+15,2021-05-10T13:53:04
LXCHEM,INE576O01020,5/10/2021,NSE,EQ,EQ,buy,FALSE,1,227.600006,54040130,1.20E+15,2021-05-10T13:54:05
NMDC,INE584A01023,5/10/2021,BSE,EQ,A,buy,FALSE,1,198.649994,9896300,1.62E+18,2021-05-10T14:41:12
TRIDENT,INE064C01022,5/11/2021,BSE,EQ,A,buy,FALSE,10,17.940001,4036400,1.62E+18,2021-05-11T09:55:35
TATACONSUM,INE192A01025,5/11/2021,NSE,EQ,EQ,buy,FALSE,1,639.5,76602814,1.30E+15,2021-05-11T09:57:56
HBLPOWER,INE292B01021,5/11/2021,BSE,EQ,B,buy,FALSE,10,35.599998,1786500,1.62E+18,2021-05-11T09:58:22
SPICEJET,INE285B01017,5/11/2021,BSE,EQ,A,buy,FALSE,5,67.150002,686600,1.62E+18,2021-05-11T10:01:48
ITC,INE154A01025,5/11/2021,BSE,EQ,A,buy,FALSE,1,206.25,2680400,1.62E+18,2021-05-11T10:12:13
KARURVYSYA,INE036D01028,5/11/2021,BSE,EQ,B,sell,FALSE,50,54.349998,848000,1.62E+18,2021-05-11T10:14:16
TRIDENT,INE064C01022,5/11/2021,BSE,EQ,A,buy,FALSE,100,18.120001,5170800,1.62E+18,2021-05-11T10:14:40
TRIDENT,INE064C01022,5/11/2021,BSE,EQ,A,buy,FALSE,12,18.139999,5219500,1.62E+18,2021-05-11T10:15:25
IDFCFIRSTB,INE092T01019,5/11/2021,BSE,EQ,A,buy,FALSE,2,55.200001,3640000,1.62E+18,2021-05-11T10:19:39
TRIDENT,INE064C01022,5/11/2021,BSE,EQ,A,buy,FALSE,1,18.370001,7470800,1.62E+18,2021-05-11T11:07:19
OIL,INE274J01014,5/11/2021,NSE,EQ,EQ,sell,FALSE,10,127.949997,52533333,1.20E+15,2021-05-11T11:29:11
GODREJIND,INE233A01035,5/11/2021,NSE,EQ,EQ,buy,FALSE,2,511.5,27781378,1.10E+15,2021-05-11T11:35:43
LUMAXTECH,INE872H01027,5/11/2021,BSE,EQ,B,sell,FALSE,19,137.800003,2412900,1.62E+18,2021-05-11T11:42:48
LUMAXTECH,INE872H01027,5/11/2021,BSE,EQ,B,sell,FALSE,1,137.850006,2412700,1.62E+18,2021-05-11T11:42:48
TATAMOTORS,INE155A01022,5/11/2021,NSE,EQ,EQ,sell,FALSE,40,316.200012,78491344,1.30E+15,2021-05-11T11:47:56
TATAPOWER,INE245A01021,5/11/2021,BSE,EQ,A,sell,FALSE,50,109.300003,4568500,1.62E+18,2021-05-11T11:48:37
TATACHEM,INE092A01019,5/11/2021,BSE,EQ,A,buy,FALSE,10,705.650024,51074100,1.62E+18,2021-05-11T11:54:33
PNB,INE160A01022,5/11/2021,BSE,EQ,A,sell,FALSE,40,34.900002,9260100,1.62E+18,2021-05-11T12:05:38
YESBANK,INE528G01035,5/11/2021,BSE,EQ,A,sell,FALSE,53,13.18,6665000,1.62E+18,2021-05-11T12:05:56
COALINDIA,INE522F01014,5/11/2021,BSE,EQ,A,sell,FALSE,50,154.649994,6701800,1.62E+18,2021-05-11T12:16:48
HINDZINC,INE267A01025,5/11/2021,NSE,EQ,EQ,sell,FALSE,10,314.950012,28364844,1.10E+15,2021-05-11T12:17:14
PRAJIND,INE074A01025,5/11/2021,BSE,EQ,A,sell,FALSE,35,340.350006,54994900,1.62E+18,2021-05-11T12:17:51
ONGC,INE213A01029,5/11/2021,NSE,EQ,EQ,sell,FALSE,30,113.599998,53144887,1.20E+15,2021-05-11T12:19:28
IDFCFIRSTB,INE092T01019,5/11/2021,BSE,EQ,A,buy,FALSE,18,55.25,8291300,1.62E+18,2021-05-11T13:20:35
DABUR,INE016A01026,5/11/2021,NSE,EQ,EQ,buy,FALSE,6,521.400024,4579795,1.00E+15,2021-05-11T13:28:14
DABUR,INE016A01026,5/11/2021,NSE,EQ,EQ,buy,FALSE,4,521.400024,4579794,1.00E+15,2021-05-11T13:28:14
DABUR,INE016A01026,5/11/2021,NSE,EQ,EQ,buy,FALSE,10,521.400024,4588490,1.00E+15,2021-05-11T13:28:52
HBLPOWER,INE292B01021,5/11/2021,BSE,EQ,B,buy,FALSE,40,36.900002,5997400,1.62E+18,2021-05-11T13:42:54
HBLPOWER,INE292B01021,5/11/2021,BSE,EQ,B,buy,FALSE,50,37,6014400,1.62E+18,2021-05-11T13:43:40
PRAJIND,INE074A01025,5/11/2021,BSE,EQ,A,buy,FALSE,40,324.549988,70431300,1.62E+18,2021-05-11T13:53:35
SPICEJET,INE285B01017,5/11/2021,BSE,EQ,A,buy,FALSE,15,68.550003,2579200,1.62E+18,2021-05-11T14:17:03
M&MFIN,INE774D01024,5/12/2021,BSE,EQ,A,sell,FALSE,26,155.550003,512900,1.62E+18,2021-05-12T09:20:18
GODREJIND,INE233A01035,5/12/2021,NSE,EQ,EQ,buy,FALSE,3,515.75,25351171,1.10E+15,2021-05-12T09:22:05
GODREJIND,INE233A01035,5/12/2021,NSE,EQ,EQ,buy,FALSE,8,515.700012,25351167,1.10E+15,2021-05-12T09:22:05
GODREJIND,INE233A01035,5/12/2021,NSE,EQ,EQ,buy,FALSE,1,515.75,25351169,1.10E+15,2021-05-12T09:22:05
GODREJIND,INE233A01035,5/12/2021,NSE,EQ,EQ,buy,FALSE,1,515.75,25351170,1.10E+15,2021-05-12T09:22:05
GODREJIND,INE233A01035,5/12/2021,NSE,EQ,EQ,buy,FALSE,5,515.700012,25351168,1.10E+15,2021-05-12T09:22:05
NMDC,INE584A01023,5/12/2021,NSE,EQ,EQ,buy,FALSE,20,206,50664371,1.20E+15,2021-05-12T09:28:22
M&MFIN,INE774D01024,5/12/2021,BSE,EQ,A,sell,FALSE,30,154.600006,2067100,1.62E+18,2021-05-12T09:53:08
MAHABANK,INE457A01014,5/12/2021,BSE,EQ,A,buy,FALSE,30,25.1,30782200,1.62E+18,2021-05-12T10:25:04
MAHABANK,INE457A01014,5/12/2021,BSE,EQ,A,buy,FALSE,100,25.1,31006100,1.62E+18,2021-05-12T10:25:33
GODREJIND,INE233A01035,5/12/2021,NSE,EQ,EQ,sell,FALSE,10,577.099976,27252563,1.10E+15,2021-05-12T10:46:45
GODREJIND,INE233A01035,5/12/2021,NSE,EQ,EQ,sell,FALSE,8,577.099976,27252564,1.10E+15,2021-05-12T10:46:45
IDFCFIRSTB,INE092T01019,5/12/2021,BSE,EQ,A,buy,FALSE,10,55.549999,7742200,1.62E+18,2021-05-12T11:16:58
KALPATPOWR,INE220B01022,5/12/2021,NSE,EQ,EQ,buy,FALSE,5,380,52814304,1.20E+15,2021-05-12T11:22:26
BIOCON,INE376G01013,5/12/2021,NSE,EQ,EQ,buy,FALSE,10,386.950012,3775687,1.00E+15,2021-05-12T12:27:18
GUFICBIO,INE742B01025,5/12/2021,NSE,EQ,EQ,buy,FALSE,10,184.75,28676551,1.10E+15,2021-05-12T12:28:13
M&M,INE101A01026,5/12/2021,NSE,EQ,EQ,sell,FALSE,16,758.150024,53602504,1.20E+15,2021-05-12T12:29:20
LINCOLN,INE405C01035,5/12/2021,NSE,EQ,EQ,buy,FALSE,2,332.350006,53657592,1.20E+15,2021-05-12T12:34:05
LINCOLN,INE405C01035,5/12/2021,NSE,EQ,EQ,buy,FALSE,2,332.25,53657590,1.20E+15,2021-05-12T12:34:05
LINCOLN,INE405C01035,5/12/2021,NSE,EQ,EQ,buy,FALSE,2,332.299988,53657591,1.20E+15,2021-05-12T12:34:05
LINCOLN,INE405C01035,5/12/2021,NSE,EQ,EQ,buy,FALSE,2,332.25,53657589,1.20E+15,2021-05-12T12:34:05
LINCOLN,INE405C01035,5/12/2021,NSE,EQ,EQ,buy,FALSE,2,332.5,53657593,1.20E+15,2021-05-12T12:34:05
BIOCON,INE376G01013,5/12/2021,NSE,EQ,EQ,buy,FALSE,9,385.950012,3985594,1.00E+15,2021-05-12T12:44:08
BIOCON,INE376G01013,5/12/2021,NSE,EQ,EQ,buy,FALSE,1,385.899994,3985593,1.00E+15,2021-05-12T12:44:08
HDFCLIFE,INE795G01014,5/12/2021,BSE,EQ,A,sell,FALSE,6,669,19223000,1.62E+18,2021-05-12T12:44:43
HDFCLIFE,INE795G01014,5/12/2021,BSE,EQ,A,sell,FALSE,4,668.75,19223200,1.62E+18,2021-05-12T12:44:43
GUFICBIO,INE742B01025,5/12/2021,NSE,EQ,EQ,buy,FALSE,10,187,28907658,1.10E+15,2021-05-12T12:45:43
MOREPENLAB,INE083A01026,5/12/2021,NSE,EQ,EQ,buy,FALSE,9,58.150002,53962016,1.20E+15,2021-05-12T13:00:56
MOREPENLAB,INE083A01026,5/12/2021,NSE,EQ,EQ,buy,FALSE,1,58.150002,53962017,1.20E+15,2021-05-12T13:00:56
LINCOLN,INE405C01035,5/12/2021,NSE,EQ,EQ,sell,FALSE,2,329.700012,53988486,1.20E+15,2021-05-12T13:03:33
LINCOLN,INE405C01035,5/12/2021,NSE,EQ,EQ,sell,FALSE,5,329.700012,53988487,1.20E+15,2021-05-12T13:03:33
LINCOLN,INE405C01035,5/12/2021,NSE,EQ,EQ,sell,FALSE,1,329.700012,53988489,1.20E+15,2021-05-12T13:03:33
LINCOLN,INE405C01035,5/12/2021,NSE,EQ,EQ,sell,FALSE,2,329.700012,53988488,1.20E+15,2021-05-12T13:03:33
GUFICBIO,INE742B01025,5/12/2021,NSE,EQ,EQ,buy,FALSE,10,189.300003,29130379,1.10E+15,2021-05-12T13:05:08
MOREPENLAB,INE083A01026,5/12/2021,NSE,EQ,EQ,buy,FALSE,10,58.349998,54053594,1.20E+15,2021-05-12T13:09:40
ITDCEM,INE686A01026,5/12/2021,NSE,EQ,EQ,buy,FALSE,15,81.900002,29606451,1.10E+15,2021-05-12T13:47:01
GODREJIND,INE233A01035,5/12/2021,NSE,EQ,EQ,sell,FALSE,2,604.900024,29625338,1.10E+15,2021-05-12T13:48:33
HINDCOPPER,INE531E01026,5/12/2021,NSE,EQ,EQ,buy,FALSE,4,179.050003,29792908,1.10E+15,2021-05-12T14:02:17
RAILTEL,INE0DD101019,5/12/2021,NSE,EQ,EQ,sell,FALSE,8,130.600006,80441058,1.30E+15,2021-05-12T14:06:55
RAILTEL,INE0DD101019,5/12/2021,NSE,EQ,EQ,sell,FALSE,12,130.550003,80441059,1.30E+15,2021-05-12T14:06:55
EXIDEIND,INE302A01020,5/12/2021,NSE,EQ,EQ,buy,FALSE,5,189.899994,29862400,1.10E+15,2021-05-12T14:07:24
TATACHEM,INE092A01019,5/12/2021,BSE,EQ,A,buy,FALSE,1,728.799988,73846600,1.62E+18,2021-05-12T14:12:14
NMDC,INE584A01023,5/12/2021,NSE,EQ,EQ,sell,FALSE,20,209.699997,54903993,1.20E+15,2021-05-12T14:22:07
SAREGAMA,INE979A01017,5/12/2021,NSE,EQ,EQ,buy,FALSE,2,1904.25,80718323,1.30E+15,2021-05-12T14:22:48
TATACHEM,INE092A01019,5/12/2021,NSE,EQ,EQ,buy,FALSE,1,733.25,80761976,1.30E+15,2021-05-12T14:25:33
IRFC,INE053F01010,5/12/2021,BSE,EQ,B,sell,FALSE,3,23.6,8465700,1.62E+18,2021-05-12T14:32:13
RAILTEL,INE0DD101019,5/12/2021,NSE,EQ,EQ,sell,FALSE,30,129.800003,80983955,1.30E+15,2021-05-12T14:36:01
GODREJIND,INE233A01035,5/12/2021,NSE,EQ,EQ,buy,FALSE,1,565.75,30520426,1.10E+15,2021-05-12T14:52:33
GODREJIND,INE233A01035,5/12/2021,NSE,EQ,EQ,buy,FALSE,13,565.799988,30520427,1.10E+15,2021-05-12T14:52:33
ITC,INE154A01025,5/12/2021,BSE,EQ,A,sell,FALSE,30,203.5,7279800,1.62E+18,2021-05-12T14:54:04
GODREJIND,INE233A01035,5/12/2021,NSE,EQ,EQ,sell,FALSE,5,567.400024,30880424,1.10E+15,2021-05-12T15:06:18
GODREJIND,INE233A01035,5/12/2021,NSE,EQ,EQ,sell,FALSE,6,567.450012,30880423,1.10E+15,2021-05-12T15:06:18
GODREJIND,INE233A01035,5/12/2021,NSE,EQ,EQ,sell,FALSE,1,567.450012,30880422,1.10E+15,2021-05-12T15:06:18
IRCTC,INE335Y01012,5/12/2021,NSE,EQ,EQ,buy,FALSE,2,1746.099976,30904234,1.10E+15,2021-05-12T15:07:38
PANACEABIO,INE922B01023,5/12/2021,NSE,EQ,EQ,buy,FALSE,5,376,55820650,1.20E+15,2021-05-12T15:08:09
PANACEABIO,INE922B01023,5/12/2021,NSE,EQ,EQ,buy,FALSE,3,375.100006,55830212,1.20E+15,2021-05-12T15:08:41
IDFCFIRSTB,INE092T01019,5/12/2021,BSE,EQ,A,buy,FALSE,10,55.299999,20360500,1.62E+18,2021-05-12T15:10:44
SPICEJET,INE285B01017,5/12/2021,NSE,EQ,EQ,buy,FALSE,1,71.949997,82035980,1.30E+15,2021-05-12T15:12:48
HBLPOWER,INE292B01021,5/14/2021,NSE,EQ,EQ,sell,FALSE,150,41.299999,25272696,1.10E+15,2021-05-14T09:19:15
VIMTALABS,INE579C01029,5/14/2021,BSE,EQ,B,sell,FALSE,10,255.800003,2197700,1.62E+18,2021-05-14T09:21:39
VIMTALABS,INE579C01029,5/14/2021,BSE,EQ,B,sell,FALSE,20,256.200012,2197500,1.62E+18,2021-05-14T09:21:39
INFY,INE009A01021,5/14/2021,NSE,EQ,EQ,buy,FALSE,2,1316.650024,26037659,1.10E+15,2021-05-14T09:45:57
IDFCFIRSTB,INE092T01019,5/14/2021,BSE,EQ,A,buy,FALSE,10,54.900002,3021500,1.62E+18,2021-05-14T09:47:00
TRIDENT,INE064C01022,5/14/2021,BSE,EQ,A,buy,FALSE,10,17.059999,2467500,1.62E+18,2021-05-14T09:51:35
TRIDENT,INE064C01022,5/14/2021,BSE,EQ,A,buy,FALSE,9,17.08,2480200,1.62E+18,2021-05-14T09:52:00
TATACHEM,INE092A01019,5/14/2021,BSE,EQ,A,buy,FALSE,3,711.049988,31507300,1.62E+18,2021-05-14T10:40:31
ASHOKLEY,INE208A01029,5/14/2021,BSE,EQ,A,buy,FALSE,10,111.800003,5042800,1.62E+18,2021-05-14T10:41:40
CDSL,INE736A01011,5/14/2021,NSE,EQ,EQ,buy,FALSE,10,815.650024,2756620,1.00E+15,2021-05-14T10:43:59
ALEMBICLTD,INE426A01027,5/14/2021,NSE,EQ,EQ,buy,FALSE,10,127.150002,3230558,1.00E+15,2021-05-14T11:11:51
ALEMBICLTD,INE426A01027,5/14/2021,NSE,EQ,EQ,buy,FALSE,15,127.150002,3237617,1.00E+15,2021-05-14T11:12:17
ALEMBICLTD,INE426A01027,5/14/2021,NSE,EQ,EQ,sell,FALSE,25,126.150002,3307459,1.00E+15,2021-05-14T11:17:23
APLLTD,INE901L01018,5/14/2021,NSE,EQ,EQ,buy,FALSE,10,954.099976,3324364,1.00E+15,2021-05-14T11:18:36
BORORENEW,INE666D01022,5/14/2021,NSE,EQ,EQ,buy,FALSE,10,275.950012,3448562,1.00E+15,2021-05-14T11:27:46
ASHOKLEY,INE208A01029,5/14/2021,BSE,EQ,A,buy,FALSE,10,112.150002,6820800,1.62E+18,2021-05-14T11:28:53
TRIDENT,INE064C01022,5/14/2021,BSE,EQ,A,buy,FALSE,20,16.66,6634500,1.62E+18,2021-05-14T12:16:16
WIPRO,INE075A01022,5/14/2021,NSE,EQ,EQ,buy,FALSE,1,494.299988,80025166,1.30E+15,2021-05-14T12:51:53
IDFCFIRSTB,INE092T01019,5/14/2021,BSE,EQ,A,buy,FALSE,5,54,11778700,1.62E+18,2021-05-14T13:59:56
KALPATPOWR,INE220B01022,5/14/2021,NSE,EQ,EQ,sell,FALSE,5,383.100006,54884012,1.20E+15,2021-05-14T14:26:38
PANACEABIO,INE922B01023,5/14/2021,NSE,EQ,EQ,sell,FALSE,8,383.149994,54886314,1.20E+15,2021-05-14T14:26:52
GODREJIND,INE233A01035,5/14/2021,NSE,EQ,EQ,sell,FALSE,2,532.950012,29723756,1.10E+15,2021-05-14T14:27:31
MOREPENLAB,INE083A01026,5/14/2021,BSE,EQ,A,sell,FALSE,20,59,67244200,1.62E+18,2021-05-14T14:29:33
IDFCFIRSTB,INE092T01019,5/17/2021,NSE,EQ,EQ,buy,FALSE,10,54.650002,25064332,1.10E+15,2021-05-17T09:15:24
HAPPSTMNDS,INE419U01012,5/17/2021,NSE,EQ,EQ,buy,FALSE,5,748,25078994,1.10E+15,2021-05-17T09:15:35
WIPRO,INE075A01022,5/17/2021,NSE,EQ,EQ,buy,FALSE,9,501.799988,75246060,1.30E+15,2021-05-17T09:18:39
IEX,INE022Q01020,5/17/2021,NSE,EQ,EQ,buy,FALSE,5,378.399994,25294779,1.10E+15,2021-05-17T09:20:07
SPICEJET,INE285B01017,5/17/2021,BSE,EQ,A,buy,FALSE,5,70.550003,204600,1.62E+18,2021-05-17T09:24:08
ITDCEM,INE686A01026,5/17/2021,NSE,EQ,EQ,sell,FALSE,15,80.099998,26132858,1.10E+15,2021-05-17T09:56:44
EVEREADY,INE128A01029,5/17/2021,NSE,EQ,EQ,sell,FALSE,5,288.600006,26196143,1.10E+15,2021-05-17T10:00:20
GODREJIND,INE233A01035,5/17/2021,NSE,EQ,EQ,buy,FALSE,4,540.849976,26467068,1.10E+15,2021-05-17T10:17:02
HAPPSTMNDS,INE419U01012,5/17/2021,NSE,EQ,EQ,buy,FALSE,1,749.299988,27959167,1.10E+15,2021-05-17T12:22:44
IEX,INE022Q01020,5/17/2021,NSE,EQ,EQ,buy,FALSE,5,375.149994,27963348,1.10E+15,2021-05-17T12:23:07
HINDCOPPER,INE531E01026,5/17/2021,BSE,EQ,A,buy,FALSE,2,170.100006,6172100,1.62E+18,2021-05-17T15:24:48
TRIDENT,INE064C01022,5/17/2021,NSE,EQ,EQ,buy,FALSE,5,16.15,81517552,1.30E+15,2021-05-17T15:26:42
SAREGAMA,INE979A01017,5/18/2021,NSE,EQ,EQ,sell,FALSE,2,2317,76573004,1.30E+15,2021-05-18T10:07:21
PRAJIND,INE074A01025,5/18/2021,NSE,EQ,EQ,sell,FALSE,40,346.5,51277865,1.20E+15,2021-05-18T10:08:32
HINDCOPPER,INE531E01026,5/18/2021,NSE,EQ,EQ,sell,FALSE,6,179.550003,30677712,1.10E+15,2021-05-18T15:23:08
BORORENEW,INE666D01022,5/18/2021,NSE,EQ,EQ,sell,FALSE,10,276.899994,6152531,1.00E+15,2021-05-18T15:23:40
ASHOKLEY,INE208A01029,5/19/2021,NSE,EQ,EQ,sell,FALSE,10,121.349998,403522,1.00E+15,2021-05-19T09:21:56
ASHOKLEY,INE208A01029,5/19/2021,NSE,EQ,EQ,sell,FALSE,74,121.349998,403521,1.00E+15,2021-05-19T09:21:56
ASHOKLEY,INE208A01029,5/19/2021,NSE,EQ,EQ,sell,FALSE,36,121.300003,403523,1.00E+15,2021-05-19T09:21:56
SAREGAMA,INE979A01017,5/19/2021,NSE,EQ,EQ,buy,FALSE,5,2359.949951,75456502,1.30E+15,2021-05-19T09:22:45
PRAJIND,INE074A01025,5/19/2021,NSE,EQ,EQ,buy,FALSE,20,381.5,50352164,1.20E+15,2021-05-19T09:23:35
ANURAS,INE930P01018,5/19/2021,NSE,EQ,EQ,buy,FALSE,10,777.799988,575637,1.00E+15,2021-05-19T09:27:05
TATACHEM,INE092A01019,5/19/2021,NSE,EQ,EQ,sell,FALSE,30,722.849976,75736981,1.30E+15,2021-05-19T09:29:24
SAREGAMA,INE979A01017,5/19/2021,NSE,EQ,EQ,buy,FALSE,1,2350,75782317,1.30E+15,2021-05-19T09:30:46
SAREGAMA,INE979A01017,5/19/2021,NSE,EQ,EQ,buy,FALSE,1,2346.149902,75897748,1.30E+15,2021-05-19T09:34:22
INTELLECT,INE306R01017,5/19/2021,NSE,EQ,EQ,buy,FALSE,5,746,25673144,1.10E+15,2021-05-19T09:36:42
IRCTC,INE335Y01012,5/19/2021,NSE,EQ,EQ,sell,FALSE,2,1846.699951,25804208,1.10E+15,2021-05-19T09:43:28
LXCHEM,INE576O01020,5/19/2021,NSE,EQ,EQ,buy,FALSE,1,223.350006,52458599,1.20E+15,2021-05-19T11:53:09
LXCHEM,INE576O01020,5/19/2021,NSE,EQ,EQ,buy,FALSE,8,223.350006,52458598,1.20E+15,2021-05-19T11:53:09
ITC,INE154A01025,5/19/2021,NSE,EQ,EQ,sell,FALSE,2,208.5,27427782,1.10E+15,2021-05-19T11:53:39
ITC,INE154A01025,5/19/2021,NSE,EQ,EQ,sell,FALSE,5,208.5,27427781,1.10E+15,2021-05-19T11:53:39
ITC,INE154A01025,5/19/2021,NSE,EQ,EQ,sell,FALSE,5,208.5,27427780,1.10E+15,2021-05-19T11:53:39
ITC,INE154A01025,5/19/2021,NSE,EQ,EQ,sell,FALSE,3,208.5,27427779,1.10E+15,2021-05-19T11:53:39
ITC,INE154A01025,5/19/2021,NSE,EQ,EQ,sell,FALSE,15,208.5,27427778,1.10E+15,2021-05-19T11:53:39
SUBEX,INE754A01055,5/19/2021,BSE,EQ,B,buy,FALSE,20,60.200001,19899600,1.62E+18,2021-05-19T12:20:58
LXCHEM,INE576O01020,5/19/2021,NSE,EQ,EQ,buy,FALSE,10,220.949997,52744867,1.20E+15,2021-05-19T12:25:09
TDPOWERSYS,INE419M01019,5/19/2021,BSE,EQ,B,buy,FALSE,10,226.850006,1468600,1.62E+18,2021-05-19T12:33:50
HAPPSTMNDS,INE419U01012,5/19/2021,BSE,EQ,B,buy,FALSE,4,761.599976,9795000,1.62E+18,2021-05-19T13:08:34
ANURAS,INE930P01018,5/19/2021,NSE,EQ,EQ,buy,FALSE,1,770.200012,4045039,1.00E+15,2021-05-19T13:09:16
SAREGAMA,INE979A01017,5/19/2021,NSE,EQ,EQ,sell,FALSE,2,2381.100098,79257245,1.30E+15,2021-05-19T13:10:10
SAREGAMA,INE979A01017,5/19/2021,NSE,EQ,EQ,sell,FALSE,5,2377.350098,79257246,1.30E+15,2021-05-19T13:10:10
PRAJIND,INE074A01025,5/19/2021,NSE,EQ,EQ,sell,FALSE,20,383.399994,53151561,1.20E+15,2021-05-19T13:11:28
VIRATCRA,INE295C01014,5/19/2021,BSE,EQ,X,buy,FALSE,50,26.200001,18832900,1.62E+18,2021-05-19T13:15:09
VIRATCRA,INE295C01014,5/19/2021,BSE,EQ,X,buy,FALSE,50,26.5,19025500,1.62E+18,2021-05-19T13:19:14
VIRATCRA,INE295C01014,5/19/2021,BSE,EQ,X,buy,FALSE,50,26.9,19066100,1.62E+18,2021-05-19T13:19:56
VIRATCRA,INE295C01014,5/19/2021,BSE,EQ,X,buy,FALSE,10,26.65,19588100,1.62E+18,2021-05-19T13:30:10
VIRATCRA,INE295C01014,5/19/2021,BSE,EQ,X,buy,FALSE,10,26.65,19610300,1.62E+18,2021-05-19T13:30:44
VIRATCRA,INE295C01014,5/19/2021,BSE,EQ,X,buy,FALSE,10,26.35,21847800,1.62E+18,2021-05-19T14:18:24
VIRATCRA,INE295C01014,5/19/2021,BSE,EQ,X,buy,FALSE,50,26,25882300,1.62E+18,2021-05-19T15:16:42
SAREGAMA,INE979A01017,5/19/2021,NSE,EQ,EQ,buy,FALSE,1,2334.399902,81125223,1.30E+15,2021-05-19T15:18:09
SAREGAMA,INE979A01017,5/19/2021,NSE,EQ,EQ,buy,FALSE,9,2328.449951,81138814,1.30E+15,2021-05-19T15:18:31
PRAJIND,INE074A01025,5/19/2021,NSE,EQ,EQ,buy,FALSE,10,386.950012,54639967,1.20E+15,2021-05-19T15:20:24
SAREGAMA,INE979A01017,5/19/2021,NSE,EQ,EQ,buy,FALSE,1,2328,81208123,1.30E+15,2021-05-19T15:20:46
BIOCON,INE376G01013,5/19/2021,NSE,EQ,EQ,sell,FALSE,20,386.350006,6048522,1.00E+15,2021-05-19T15:23:36
SAREGAMA,INE979A01017,5/19/2021,NSE,EQ,EQ,buy,FALSE,1,2327.949951,81312679,1.30E+15,2021-05-19T15:23:55
PRAJIND,INE074A01025,5/19/2021,NSE,EQ,EQ,buy,FALSE,10,389.600006,54740631,1.20E+15,2021-05-19T15:24:23
IEX,INE022Q01020,5/20/2021,NSE,EQ,EQ,buy,FALSE,5,363.100006,25243206,1.10E+15,2021-05-20T09:19:08
IEX,INE022Q01020,5/20/2021,NSE,EQ,EQ,buy,FALSE,5,363.149994,25243207,1.10E+15,2021-05-20T09:19:08
INTELLECT,INE306R01017,5/20/2021,BSE,EQ,A,buy,FALSE,5,747.5,400800,1.62E+18,2021-05-20T09:23:30
NMDC,INE584A01023,5/20/2021,NSE,EQ,EQ,sell,FALSE,1,179.149994,50353346,1.20E+15,2021-05-20T09:24:28
APLLTD,INE901L01018,5/20/2021,NSE,EQ,EQ,sell,FALSE,10,957.299988,1040982,1.00E+15,2021-05-20T09:44:28
ANURAS,INE930P01018,5/20/2021,NSE,EQ,EQ,buy,FALSE,5,773.900024,1256293,1.00E+15,2021-05-20T09:56:02
PRAJIND,INE074A01025,5/20/2021,BSE,EQ,A,buy,FALSE,10,383.149994,22861400,1.62E+18,2021-05-20T10:07:25
TDPOWERSYS,INE419M01019,5/20/2021,NSE,EQ,EQ,buy,FALSE,10,199.899994,79681598,1.30E+15,2021-05-20T14:18:20
PRAJIND,INE074A01025,5/20/2021,BSE,EQ,A,buy,FALSE,5,378.75,70582200,1.62E+18,2021-05-20T14:19:10
VIRATCRA,INE295C01014,5/20/2021,BSE,EQ,X,buy,FALSE,10,25.85,19140100,1.62E+18,2021-05-20T14:36:07
IDFCFIRSTB,INE092T01019,5/20/2021,NSE,EQ,EQ,buy,FALSE,2,55.200001,29646287,1.10E+15,2021-05-20T14:40:18
JUSTDIAL,INE599M01018,5/21/2021,NSE,EQ,EQ,buy,FALSE,1,811.5,50332791,1.20E+15,2021-05-21T09:22:58
TIPSINDLTD,INE716B01011,5/21/2021,NSE,EQ,EQ,buy,FALSE,1,940,75532853,1.30E+15,2021-05-21T09:26:30
TDPOWERSYS,INE419M01019,5/21/2021,NSE,EQ,EQ,sell,FALSE,10,196.25,75593618,1.30E+15,2021-05-21T09:28:40
TDPOWERSYS,INE419M01019,5/21/2021,NSE,EQ,EQ,sell,FALSE,6,196.149994,75593619,1.30E+15,2021-05-21T09:28:40
TDPOWERSYS,INE419M01019,5/21/2021,NSE,EQ,EQ,sell,FALSE,4,196.300003,75593617,1.30E+15,2021-05-21T09:28:40
PRAJIND,INE074A01025,5/21/2021,NSE,EQ,EQ,buy,FALSE,2,375.950012,50499527,1.20E+15,2021-05-21T09:29:26
TIPSINDLTD,INE716B01011,5/21/2021,NSE,EQ,EQ,buy,FALSE,2,979.950012,75621670,1.30E+15,2021-05-21T09:29:44
TATACONSUM,INE192A01025,5/21/2021,NSE,EQ,EQ,sell,FALSE,7,646.299988,75636847,1.30E+15,2021-05-21T09:30:19
PRAJIND,INE074A01025,5/21/2021,NSE,EQ,EQ,buy,FALSE,3,378,50549091,1.20E+15,2021-05-21T09:31:22
TIPSINDLTD,INE716B01011,5/21/2021,NSE,EQ,EQ,buy,FALSE,3,993.950012,75697069,1.30E+15,2021-05-21T09:32:35
EXIDEIND,INE302A01020,5/21/2021,NSE,EQ,EQ,sell,FALSE,40,187.850006,27637841,1.10E+15,2021-05-21T11:29:08
TIPSINDLTD,INE716B01011,5/21/2021,NSE,EQ,EQ,buy,FALSE,1,964.900024,77481551,1.30E+15,2021-05-21T11:29:18
PRAJIND,INE074A01025,5/21/2021,NSE,EQ,EQ,buy,FALSE,8,354.950012,52263048,1.20E+15,2021-05-21T11:31:05
PRAJIND,INE074A01025,5/21/2021,NSE,EQ,EQ,buy,FALSE,2,354.75,52263047,1.20E+15,2021-05-21T11:31:05
PRAJIND,INE074A01025,5/21/2021,NSE,EQ,EQ,buy,FALSE,1,354,53079976,1.20E+15,2021-05-21T12:36:38
PRAJIND,INE074A01025,5/21/2021,NSE,EQ,EQ,buy,FALSE,1,353.75,53121891,1.20E+15,2021-05-21T12:40:09
GODREJIND,INE233A01035,5/21/2021,NSE,EQ,EQ,buy,FALSE,1,570.900024,28453105,1.10E+15,2021-05-21T12:41:35
SBIN,INE062A01020,5/24/2021,NSE,EQ,EQ,buy,FALSE,1,412.75,75238786,1.30E+15,2021-05-24T09:18:09
PRAJIND,INE074A01025,5/24/2021,BSE,EQ,A,buy,FALSE,8,340,5312700,1.62E+18,2021-05-24T09:20:40
SUBEXLTD,INE754A01055,5/24/2021,NSE,EQ,EQ,sell,FALSE,20,56.650002,75934367,1.30E+15,2021-05-24T09:39:01
GODREJIND,INE233A01035,5/24/2021,BSE,EQ,A,buy,FALSE,1,546.599976,2027200,1.62E+18,2021-05-24T09:47:13
PRAJIND,INE074A01025,5/24/2021,BSE,EQ,A,buy,FALSE,2,333.399994,38671200,1.62E+18,2021-05-24T11:00:05
M&MFIN,INE774D01024,5/24/2021,NSE,EQ,EQ,buy,FALSE,1,164.600006,53898548,1.20E+15,2021-05-24T12:50:16
GODREJIND,INE233A01035,5/25/2021,NSE,EQ,EQ,sell,FALSE,2,565,25039395,1.10E+15,2021-05-25T09:15:12
GODREJIND,INE233A01035,5/25/2021,NSE,EQ,EQ,sell,FALSE,4,565.049988,25039394,1.10E+15,2021-05-25T09:15:12
PRAJIND,INE074A01025,5/25/2021,NSE,EQ,EQ,buy,FALSE,5,335.950012,50084266,1.20E+15,2021-05-25T09:15:47
GUFICBIO,INE742B01025,5/25/2021,NSE,EQ,EQ,sell,FALSE,30,193.75,26026491,1.10E+15,2021-05-25T09:49:47
TIPSINDLTD,INE716B01011,5/25/2021,NSE,EQ,EQ,buy,FALSE,3,1047.849976,76113694,1.30E+15,2021-05-25T09:50:07
VIRATCRA,INE295C01014,5/25/2021,BSE,EQ,X,sell,FALSE,240,24.549999,6723300,1.62E+18,2021-05-25T10:04:07
JUSTDIAL,INE599M01018,5/25/2021,NSE,EQ,EQ,buy,FALSE,3,805,51462006,1.20E+15,2021-05-25T10:06:37
PRAJIND,INE074A01025,5/25/2021,NSE,EQ,EQ,buy,FALSE,5,352.799988,51471645,1.20E+15,2021-05-25T10:07:10
SPICEJET,INE285B01017,5/25/2021,NSE,EQ,EQ,buy,FALSE,14,82.75,76916391,1.30E+15,2021-05-25T10:33:35
JUSTDIAL,INE599M01018,5/25/2021,NSE,EQ,EQ,buy,FALSE,1,804.599976,51941372,1.20E+15,2021-05-25T10:35:58
PRAJIND,INE074A01025,5/25/2021,NSE,EQ,EQ,buy,FALSE,3,350.950012,51976676,1.20E+15,2021-05-25T10:38:43
TATAPOWER,INE245A01021,5/25/2021,NSE,EQ,EQ,buy,FALSE,3,109.050003,77047395,1.30E+15,2021-05-25T10:41:35
PRAJIND,INE074A01025,5/26/2021,NSE,EQ,EQ,buy,FALSE,1,362,51429220,1.20E+15,2021-05-26T10:17:24
PRAJIND,INE074A01025,5/26/2021,NSE,EQ,EQ,buy,FALSE,4,362,51431610,1.20E+15,2021-05-26T10:17:34
PRINCEPIPE,INE689W01016,5/26/2021,NSE,EQ,EQ,buy,FALSE,1,739.700012,51485793,1.20E+15,2021-05-26T10:21:14
PRAJIND,INE074A01025,5/27/2021,BSE,EQ,A,buy,FALSE,1,346.5,16098700,1.62E+18,2021-05-27T09:43:10
TRIDENT,INE064C01022,5/27/2021,BSE,EQ,A,buy,FALSE,3,16.780001,1179900,1.62E+18,2021-05-27T09:48:12
M&MFIN,INE774D01024,5/28/2021,NSE,EQ,EQ,sell,FALSE,1,155.699997,52463755,1.20E+15,2021-05-28T11:49:50
SPICEJET,INE285B01017,5/28/2021,NSE,EQ,EQ,sell,FALSE,100,79.150002,78441913,1.30E+15,2021-05-28T11:50:19
PRAJIND,INE074A01025,5/28/2021,NSE,EQ,EQ,buy,FALSE,5,337.899994,52705078,1.20E+15,2021-05-28T12:16:04
XELPMOC,INE01P501012,5/28/2021,NSE,EQ,EQ,buy,FALSE,1,281.100006,79854152,1.30E+15,2021-05-28T13:48:41
XELPMOC,INE01P501012,5/28/2021,NSE,EQ,EQ,buy,FALSE,2,281.049988,79854150,1.30E+15,2021-05-28T13:48:41
XELPMOC,INE01P501012,5/28/2021,NSE,EQ,EQ,buy,FALSE,6,281.100006,79854151,1.30E+15,2021-05-28T13:48:41
XELPMOC,INE01P501012,5/28/2021,NSE,EQ,EQ,buy,FALSE,1,281,79854149,1.30E+15,2021-05-28T13:48:41
XELPMOC,INE01P501012,5/28/2021,NSE,EQ,EQ,buy,FALSE,5,281.100006,79860641,1.30E+15,2021-05-28T13:49:11
PRAJIND,INE074A01025,5/28/2021,NSE,EQ,EQ,buy,FALSE,1,337.5,53611095,1.20E+15,2021-05-28T13:50:37
PRAJIND,INE074A01025,5/31/2021,BSE,EQ,A,buy,FALSE,3,339.5,6923400,1.62E+18,2021-05-31T09:23:18
AMARAJABAT,INE885A01032,5/31/2021,NSE,EQ,EQ,buy,FALSE,1,743.75,466084,1.00E+15,2021-05-31T09:25:22
ANURAS,INE930P01018,5/31/2021,BSE,EQ,B,sell,FALSE,2,761.450012,1017100,1.62E+18,2021-05-31T09:27:53
ANURAS,INE930P01018,5/31/2021,BSE,EQ,B,sell,FALSE,3,761.400024,1017300,1.62E+18,2021-05-31T09:27:53
HAPPSTMNDS,INE419U01012,5/31/2021,NSE,EQ,EQ,sell,FALSE,2,853.25,25606832,1.10E+15,2021-05-31T09:29:36
HAPPSTMNDS,INE419U01012,5/31/2021,NSE,EQ,EQ,sell,FALSE,8,853.200012,25606833,1.10E+15,2021-05-31T09:29:36
TIPSINDLTD,INE716B01011,5/31/2021,NSE,EQ,EQ,buy,FALSE,1,985,75725163,1.30E+15,2021-05-31T09:31:46
TATACHEM,INE092A01019,5/31/2021,NSE,EQ,EQ,buy,FALSE,1,707.900024,75922496,1.30E+15,2021-05-31T09:38:16
TIPSINDLTD,INE716B01011,5/31/2021,NSE,EQ,EQ,buy,FALSE,1,961.900024,76151653,1.30E+15,2021-05-31T09:46:51
TATACHEM,INE092A01019,5/31/2021,NSE,EQ,EQ,buy,FALSE,1,703.950012,76413640,1.30E+15,2021-05-31T09:58:34
CDSL,INE736A01011,5/31/2021,NSE,EQ,EQ,buy,FALSE,1,989.849976,1448976,1.00E+15,2021-05-31T10:05:39
CDSL,INE736A01011,5/31/2021,NSE,EQ,EQ,buy,FALSE,1,989.799988,1448975,1.00E+15,2021-05-31T10:05:39
ASIANPAINT,INE021A01026,5/31/2021,NSE,EQ,EQ,buy,FALSE,1,2974.800049,1463748,1.00E+15,2021-05-31T10:06:33
AMARAJABAT,INE885A01032,5/31/2021,NSE,EQ,EQ,buy,FALSE,2,742.25,1471370,1.00E+15,2021-05-31T10:07:02
INTELLECT,INE306R01017,5/31/2021,NSE,EQ,EQ,sell,FALSE,10,761.849976,26542934,1.10E+15,2021-05-31T10:14:25
IEX,INE022Q01020,5/31/2021,NSE,EQ,EQ,sell,FALSE,10,354.799988,26689533,1.10E+15,2021-05-31T10:23:52
ITC,INE154A01025,5/31/2021,NSE,EQ,EQ,buy,FALSE,10,216.949997,26710236,1.10E+15,2021-05-31T10:25:35
ANURAS,INE930P01018,5/31/2021,BSE,EQ,B,sell,FALSE,1,764.049988,4421300,1.62E+18,2021-05-31T10:37:47
ANURAS,INE930P01018,5/31/2021,BSE,EQ,B,sell,FALSE,5,764,4421500,1.62E+18,2021-05-31T10:37:47
HAPPSTMNDS,INE419U01012,5/31/2021,NSE,EQ,EQ,buy,FALSE,10,883.700012,26888928,1.10E+15,2021-05-31T10:38:06
JUSTDIAL,INE599M01018,5/31/2021,NSE,EQ,EQ,buy,FALSE,3,938.950012,52125781,1.20E+15,2021-05-31T10:57:21
REDINGTON,INE891D01026,5/31/2021,NSE,EQ,EQ,buy,FALSE,1,256.100006,77479007,1.30E+15,2021-05-31T10:59:51
TRIDENT,INE064C01022,5/31/2021,BSE,EQ,A,sell,FALSE,208,15.96,3636100,1.62E+18,2021-05-31T11:06:45
INTELLECT,INE306R01017,5/31/2021,NSE,EQ,EQ,buy,FALSE,3,770.900024,27314103,1.10E+15,2021-05-31T11:10:08
TIPSINDLTD,INE716B01011,5/31/2021,NSE,EQ,EQ,buy,FALSE,1,947.450012,78523278,1.30E+15,2021-05-31T12:14:56
ITC,INE154A01025,6/1/2021,NSE,EQ,EQ,buy,FALSE,15,216.899994,27195896,1.10E+15,2021-06-01T11:11:20
SUNPHARMA,INE044A01036,6/1/2021,NSE,EQ,EQ,buy,FALSE,1,666.849976,78935216,1.30E+15,2021-06-01T12:55:17
SAREGAMA,INE979A01017,6/1/2021,NSE,EQ,EQ,sell,FALSE,1,2591.149902,78951345,1.30E+15,2021-06-01T12:56:57
SAREGAMA,INE979A01017,6/1/2021,NSE,EQ,EQ,sell,FALSE,3,2591.050049,78951346,1.30E+15,2021-06-01T12:56:57
SAREGAMA,INE979A01017,6/1/2021,NSE,EQ,EQ,sell,FALSE,2,2591.199951,78951344,1.30E+15,2021-06-01T12:56:57
SAREGAMA,INE979A01017,6/1/2021,NSE,EQ,EQ,sell,FALSE,1,2592.449951,78951342,1.30E+15,2021-06-01T12:56:57
SAREGAMA,INE979A01017,6/1/2021,NSE,EQ,EQ,sell,FALSE,4,2592.449951,78951343,1.30E+15,2021-06-01T12:56:57
BALKRISIND,INE787D01026,6/2/2021,BSE,EQ,A,buy,FALSE,1,2173.75,34100,1.62E+18,2021-06-02T09:15:30
SAREGAMA,INE979A01017,6/2/2021,BSE,EQ,A,buy,FALSE,2,2658.949951,1304400,1.62E+18,2021-06-02T09:16:10
SAREGAMA,INE979A01017,6/2/2021,BSE,EQ,A,buy,FALSE,4,2657.75,1304200,1.62E+18,2021-06-02T09:16:10
SAREGAMA,INE979A01017,6/2/2021,BSE,EQ,A,buy,FALSE,2,2680,1304600,1.62E+18,2021-06-02T09:16:10
CDSL,INE736A01011,6/2/2021,NSE,EQ,EQ,buy,FALSE,2,970.950012,132003,1.00E+15,2021-06-02T09:16:42
TIPSINDLTD,INE716B01011,6/2/2021,BSE,EQ,B,buy,FALSE,2,901.549988,2119300,1.62E+18,2021-06-02T09:18:59
TIPSINDLTD,INE716B01011,6/2/2021,BSE,EQ,B,sell,FALSE,1,878,16530000,1.62E+18,2021-06-02T10:38:02
TIPSINDLTD,INE716B01011,6/2/2021,BSE,EQ,B,sell,FALSE,1,876.950012,16530200,1.62E+18,2021-06-02T10:38:02
SAREGAMA,INE979A01017,6/2/2021,BSE,EQ,A,sell,FALSE,1,2609.699951,33043100,1.62E+18,2021-06-02T10:38:30
SAREGAMA,INE979A01017,6/2/2021,BSE,EQ,A,sell,FALSE,5,2609.649902,33043300,1.62E+18,2021-06-02T10:38:30
SAREGAMA,INE979A01017,6/2/2021,BSE,EQ,A,sell,FALSE,2,2609.600098,33043500,1.62E+18,2021-06-02T10:38:30
AMARAJABAT,INE885A01032,6/3/2021,NSE,EQ,EQ,buy,FALSE,5,753.849976,2505983,1.00E+15,2021-06-03T11:31:28
INTELLECT,INE306R01017,6/3/2021,BSE,EQ,A,sell,FALSE,3,760.75,3597700,1.62E+18,2021-06-03T11:55:29
ASIANPAINT,INE021A01026,6/3/2021,BSE,EQ,A,buy,FALSE,1,2914.75,9403200,1.62E+18,2021-06-03T11:56:05
PRINCEPIPE,INE689W01016,6/3/2021,BSE,EQ,A,sell,FALSE,1,716.099976,52185500,1.62E+18,2021-06-03T11:57:56
REDINGTON,INE891D01026,6/3/2021,BSE,EQ,A,sell,FALSE,1,240.850006,4112600,1.62E+18,2021-06-03T11:58:01
SUNPHARMA,INE044A01036,6/3/2021,BSE,EQ,A,sell,FALSE,1,676.349976,10848600,1.62E+18,2021-06-03T11:58:54
TATAPOWER,INE245A01021,6/3/2021,NSE,EQ,EQ,sell,FALSE,3,109.050003,77961896,1.30E+15,2021-06-03T11:59:07
TIPSINDLTD,INE716B01011,6/4/2021,BSE,EQ,B,buy,FALSE,2,868.25,1414300,1.62E+18,2021-06-04T09:17:21
TIPSINDLTD,INE716B01011,6/4/2021,BSE,EQ,B,buy,FALSE,3,850,3605100,1.62E+18,2021-06-04T09:22:46
TIPSINDLTD,INE716B01011,6/4/2021,BSE,EQ,B,buy,FALSE,3,835.549988,4171500,1.62E+18,2021-06-04T09:25:00
ITC,INE154A01025,6/4/2021,BSE,EQ,A,buy,FALSE,5,208.75,2019300,1.62E+18,2021-06-04T09:58:28
WIPRO,INE075A01022,6/4/2021,NSE,EQ,EQ,buy,FALSE,2,543.099976,76428330,1.30E+15,2021-06-04T10:11:46
TIPSINDLTD,INE716B01011,6/4/2021,BSE,EQ,B,buy,FALSE,2,828.349976,17469100,1.62E+18,2021-06-04T10:38:20
SAREGAMA,INE979A01017,6/4/2021,NSE,EQ,EQ,sell,FALSE,1,2439.949951,77516030,1.30E+15,2021-06-04T11:23:29
ITC,INE154A01025,6/7/2021,BSE,EQ,A,buy,FALSE,20,211.800003,2779700,1.62E+18,2021-06-07T10:08:55
TIPSINDLTD,INE716B01011,6/7/2021,BSE,EQ,B,buy,FALSE,2,870.950012,22822700,1.62E+18,2021-06-07T10:48:39
JUSTDIAL,INE599M01018,6/7/2021,BSE,EQ,A,buy,FALSE,1,986.549988,5512400,1.62E+18,2021-06-07T11:15:38
JUSTDIAL,INE599M01018,6/7/2021,BSE,EQ,A,buy,FALSE,1,986.599976,5512600,1.62E+18,2021-06-07T11:15:38
TATACHEM,INE092A01019,6/7/2021,NSE,EQ,EQ,buy,FALSE,1,749,79447116,1.30E+15,2021-06-07T13:20:03
ITC,INE154A01025,6/8/2021,BSE,EQ,A,buy,FALSE,5,211.949997,1907200,1.62E+18,2021-06-08T09:39:25
PRAJIND,INE074A01025,6/8/2021,NSE,EQ,EQ,sell,FALSE,53,383.850006,51255680,1.20E+15,2021-06-08T09:54:20
PRAJIND,INE074A01025,6/8/2021,NSE,EQ,EQ,sell,FALSE,2,383.850006,51255678,1.20E+15,2021-06-08T09:54:20
PRAJIND,INE074A01025,6/8/2021,NSE,EQ,EQ,sell,FALSE,9,383.850006,51255679,1.20E+15,2021-06-08T09:54:20
PRAJIND,INE074A01025,6/8/2021,NSE,EQ,EQ,sell,FALSE,15,383.850006,51255675,1.20E+15,2021-06-08T09:54:20
PRAJIND,INE074A01025,6/8/2021,NSE,EQ,EQ,sell,FALSE,10,383.850006,51255676,1.20E+15,2021-06-08T09:54:20
PRAJIND,INE074A01025,6/8/2021,NSE,EQ,EQ,sell,FALSE,1,383.850006,51255677,1.20E+15,2021-06-08T09:54:20
PRAJIND,INE074A01025,6/8/2021,NSE,EQ,EQ,buy,FALSE,70,389,52633203,1.20E+15,2021-06-08T11:09:45
ITC,INE154A01025,6/8/2021,BSE,EQ,A,buy,FALSE,5,211.850006,6196500,1.62E+18,2021-06-08T11:13:14
PRAJIND,INE074A01025,6/8/2021,NSE,EQ,EQ,buy,FALSE,10,387.75,52990819,1.20E+15,2021-06-08T11:34:18
PRAJIND,INE074A01025,6/8/2021,NSE,EQ,EQ,sell,FALSE,5,387.600006,52996674,1.20E+15,2021-06-08T11:34:52
M&M,INE101A01026,6/9/2021,NSE,EQ,EQ,buy,FALSE,5,808.5,50420526,1.20E+15,2021-06-09T09:23:19
ANURAS,INE930P01018,6/10/2021,BSE,EQ,B,buy,FALSE,1,759.099976,1308600,1.62E+18,2021-06-10T09:24:01
HBLPOWER,INE292B01021,6/15/2021,NSE,EQ,EQ,buy,FALSE,1,47,27066950,1.10E+15,2021-06-15T11:08:30
XELPMOC,INE01P501012,6/25/2021,BSE,EQ,B,sell,FALSE,4,328.700012,2368400,1.62E+18,2021-06-25T09:23:50
XELPMOC,INE01P501012,6/25/2021,BSE,EQ,B,sell,FALSE,11,328.649994,2368600,1.62E+18,2021-06-25T09:23:50
TATACHEM,INE092A01019,6/25/2021,NSE,EQ,EQ,buy,FALSE,1,715,75703618,1.30E+15,2021-06-25T09:28:51
TATACHEM,INE092A01019,6/25/2021,NSE,EQ,EQ,buy,FALSE,1,715,75703619,1.30E+15,2021-06-25T09:28:51
ANURAS,INE930P01018,6/25/2021,NSE,EQ,EQ,buy,FALSE,1,741,530682,1.00E+15,2021-06-25T09:30:30
MTARTECH,INE864I01014,6/25/2021,NSE,EQ,EQ,buy,FALSE,1,976.900024,50498458,1.20E+15,2021-06-25T09:31:46
M&M,INE101A01026,6/25/2021,BSE,EQ,A,buy,FALSE,1,799.799988,1144700,1.62E+18,2021-06-25T09:32:56
IDFCFIRSTB,INE092T01019,6/30/2021,NSE,EQ,EQ,buy,FALSE,8,55,25779608,1.10E+15,2021-06-30T09:41:36
ITC,INE154A01025,6/30/2021,BSE,EQ,A,buy,FALSE,2,203.5,3020600,1.63E+18,2021-06-30T11:09:25
TIPSINDLTD,INE716B01011,6/30/2021,BSE,EQ,T,sell,FALSE,7,1435,11815600,1.63E+18,2021-06-30T11:30:59
TIPSINDLTD,INE716B01011,6/30/2021,BSE,EQ,T,sell,FALSE,18,1431,11815800,1.63E+18,2021-06-30T11:30:59
ANURAS,INE930P01018,7/1/2021,BSE,EQ,B,buy,FALSE,3,763.950012,6338900,1.63E+18,2021-07-01T10:22:36
WIPRO,INE075A01022,7/1/2021,NSE,EQ,EQ,buy,FALSE,3,541.599976,76599693,1.30E+15,2021-07-01T10:24:39
HAPPSTMNDS,INE419U01012,7/1/2021,BSE,EQ,B,buy,FALSE,1,1044.849976,6416000,1.63E+18,2021-07-01T10:24:51
HAPPSTMNDS,INE419U01012,7/1/2021,BSE,EQ,B,buy,FALSE,1,1044.800049,6415800,1.63E+18,2021-07-01T10:24:51
HAPPSTMNDS,INE419U01012,7/1/2021,BSE,EQ,B,buy,FALSE,3,1044.900024,6416200,1.63E+18,2021-07-01T10:24:51
M&M,INE101A01026,7/1/2021,BSE,EQ,A,buy,FALSE,6,791.549988,2567900,1.63E+18,2021-07-01T10:25:29
TATAMOTORS,INE155A01022,7/1/2021,NSE,EQ,EQ,buy,FALSE,15,343.600006,76632504,1.30E+15,2021-07-01T10:27:14
MTARTECH,INE864I01014,7/1/2021,NSE,EQ,EQ,buy,FALSE,1,1171,51463651,1.20E+15,2021-07-01T10:28:22
TATACHEM,INE092A01019,7/1/2021,BSE,EQ,A,buy,FALSE,5,726.650024,26570400,1.63E+18,2021-07-01T10:29:41
M&M,INE101A01026,7/1/2021,BSE,EQ,A,buy,FALSE,4,786.799988,2720700,1.63E+18,2021-07-01T10:36:30
ASHOKLEY,INE208A01029,7/1/2021,NSE,EQ,EQ,buy,FALSE,20,124.25,2123566,1.00E+15,2021-07-01T12:06:21
MTARTECH,INE864I01014,7/5/2021,BSE,EQ,B,buy,FALSE,1,1420.25,13095500,1.63E+18,2021-07-05T12:26:45
INDIGO,INE646L01027,7/6/2021,NSE,EQ,EQ,buy,FALSE,1,1799.949951,27200444,1.10E+15,2021-07-06T10:45:11
IDFCFIRSTB,INE092T01019,7/9/2021,BSE,EQ,A,buy,FALSE,2,53.099998,244300,1.63E+18,2021-07-09T09:15:26
M&M,INE101A01026,7/14/2021,BSE,EQ,A,buy,FALSE,4,782.75,497700,1.63E+18,2021-07-14T09:38:14
WIPRO,INE075A01022,7/14/2021,BSE,EQ,A,buy,FALSE,5,527.5,3540200,1.63E+18,2021-07-14T09:58:44
HBLPOWER,INE292B01021,7/14/2021,NSE,EQ,EQ,buy,FALSE,10,54.450001,26198740,1.10E+15,2021-07-14T09:59:13
CDSL,INE736A01011,7/14/2021,NSE,EQ,EQ,buy,FALSE,3,1236.199951,988580,1.00E+15,2021-07-14T09:59:54
ASHOKLEY,INE208A01029,7/19/2021,NSE,EQ,EQ,sell,FALSE,20,126.800003,318652,1.00E+15,2021-07-19T09:22:16
CDSL,INE736A01011,7/19/2021,NSE,EQ,EQ,buy,FALSE,1,1491.650024,961827,1.00E+15,2021-07-19T09:48:05
TATAMOTORS,INE155A01022,7/19/2021,NSE,EQ,EQ,buy,FALSE,1,309.5,77651595,1.30E+15,2021-07-19T11:52:21
IDFCFIRSTB,INE092T01019,7/19/2021,NSE,EQ,EQ,buy,FALSE,3,53.200001,28610362,1.10E+15,2021-07-19T11:55:31
AMARAJABAT,INE885A01032,7/19/2021,BSE,EQ,A,buy,FALSE,3,723.799988,5683500,1.63E+18,2021-07-19T13:09:29
TATAMOTORS,INE155A01022,7/19/2021,NSE,EQ,EQ,buy,FALSE,1,306.950012,78577367,1.30E+15,2021-07-19T13:10:10
IDFCFIRSTB,INE092T01019,7/19/2021,NSE,EQ,EQ,buy,FALSE,1,53,29851352,1.10E+15,2021-07-19T13:17:28
JUSTDIAL,INE599M01018,7/20/2021,NSE,EQ,EQ,sell,FALSE,10,993.5,52291486,1.20E+15,2021-07-20T11:18:51
CLEAN,INE227W01023,7/20/2021,NSE,EQ,EQ,buy,FALSE,1,1687,2696226,1.00E+15,2021-07-20T11:28:26
CLEAN,INE227W01023,7/20/2021,NSE,EQ,EQ,buy,FALSE,1,1686.949951,2696225,1.00E+15,2021-07-20T11:28:26
AMARAJABAT,INE885A01032,7/20/2021,BSE,EQ,A,buy,FALSE,4,710.549988,6961700,1.63E+18,2021-07-20T11:48:13
M&M,INE101A01026,7/20/2021,NSE,EQ,EQ,buy,FALSE,2,758.150024,52751207,1.20E+15,2021-07-20T11:59:12
AMARAJABAT,INE885A01032,7/20/2021,BSE,EQ,A,buy,FALSE,1,714.849976,9345900,1.63E+18,2021-07-20T14:05:13
SBIN,INE062A01020,7/22/2021,NSE,EQ,EQ,sell,FALSE,1,425.600006,76072132,1.30E+15,2021-07-22T09:50:19
HAPPSTMNDS,INE419U01012,7/22/2021,NSE,EQ,EQ,buy,FALSE,1,1467,26842184,1.10E+15,2021-07-22T10:09:55
HAPPSTMNDS,INE419U01012,7/23/2021,NSE,EQ,EQ,buy,FALSE,2,1411.800049,28871771,1.10E+15,2021-07-23T13:19:08
KOTAKBANK,INE237A01028,7/26/2021,NSE,EQ,EQ,buy,FALSE,2,1724.900024,51730987,1.20E+15,2021-07-26T10:28:35
FDC,INE258B01022,7/26/2021,NSE,EQ,EQ,buy,FALSE,2,383.25,27041750,1.10E+15,2021-07-26T10:36:10
IDFCFIRSTB,INE092T01019,7/27/2021,BSE,EQ,A,buy,FALSE,1,51.5,4590400,1.63E+18,2021-07-27T10:31:53
LXCHEM,INE576O01020,7/27/2021,NSE,EQ,EQ,sell,FALSE,5,258.5,53322150,1.20E+15,2021-07-27T12:52:51
LXCHEM,INE576O01020,7/27/2021,NSE,EQ,EQ,sell,FALSE,3,258.600006,53322149,1.20E+15,2021-07-27T12:52:51
INDIGO,INE646L01027,7/28/2021,BSE,EQ,A,buy,FALSE,1,1635.949951,1791200,1.63E+18,2021-07-28T10:17:19
TATAMOTORS,INE155A01022,7/28/2021,NSE,EQ,EQ,buy,FALSE,1,284.850006,77549418,1.30E+15,2021-07-28T10:56:04
IDFCFIRSTB,INE092T01019,7/28/2021,NSE,EQ,EQ,buy,FALSE,3,50.200001,28470093,1.10E+15,2021-07-28T11:58:00
PRAJIND,INE074A01025,7/30/2021,NSE,EQ,BE,sell,FALSE,5,376,51707609,1.20E+15,2021-07-30T10:27:32
IEX,INE022Q01020,8/3/2021,NSE,EQ,EQ,buy,FALSE,1,429.549988,26495330,1.10E+15,2021-08-03T10:12:18
AMARAJABAT,INE885A01032,8/4/2021,BSE,EQ,A,buy,FALSE,3,728.299988,4294900,1.63E+18,2021-08-04T10:18:40
AMARAJABAT,INE885A01032,8/4/2021,BSE,EQ,A,buy,FALSE,1,728.299988,4305600,1.63E+18,2021-08-04T10:19:27
PRAJIND,INE074A01025,8/4/2021,BSE,EQ,T,sell,FALSE,10,389,9641700,1.63E+18,2021-08-04T10:27:25
IEX,INE022Q01020,8/4/2021,BSE,EQ,A,buy,FALSE,4,425.299988,4211600,1.63E+18,2021-08-04T10:32:42
CDSL,INE736A01011,8/4/2021,NSE,EQ,BE,buy,FALSE,2,1381,1460590,1.00E+15,2021-08-04T10:38:06
CLEAN,INE227W01023,8/4/2021,NSE,EQ,EQ,buy,FALSE,1,1662.550049,1476158,1.00E+15,2021-08-04T10:39:28
MAHABANK,INE457A01014,8/4/2021,BSE,EQ,A,sell,FALSE,200,21.5,33438500,1.63E+18,2021-08-04T10:39:43
TATAMOTORS,INE155A01022,8/4/2021,BSE,EQ,A,buy,FALSE,3,301.850006,6418600,1.63E+18,2021-08-04T11:11:25
HAPPSTMNDS,INE419U01012,8/4/2021,BSE,EQ,B,buy,FALSE,1,1358.900024,16414600,1.63E+18,2021-08-04T12:53:13
HAPPSTMNDS,INE419U01012,8/4/2021,BSE,EQ,B,buy,FALSE,1,1358.650024,16425100,1.63E+18,2021-08-04T12:53:26
IDFCFIRSTB,INE092T01019,8/5/2021,BSE,EQ,A,buy,FALSE,15,47.099998,4679500,1.63E+18,2021-08-05T09:43:39
HBLPOWER,INE292B01021,8/5/2021,BSE,EQ,B,buy,FALSE,8,48.150002,2362000,1.63E+18,2021-08-05T09:56:19
HBLPOWER,INE292B01021,8/5/2021,BSE,EQ,B,buy,FALSE,6,48.200001,2362200,1.63E+18,2021-08-05T09:56:19
PRAJIND,INE074A01025,8/9/2021,NSE,EQ,BE,sell,FALSE,10,377.75,51316906,1.20E+15,2021-08-09T10:29:36
IDFCFIRSTB,INE092T01019,8/10/2021,BSE,EQ,A,buy,FALSE,20,46.349998,6052500,1.63E+18,2021-08-10T11:30:50
TATACHEM,INE092A01019,8/10/2021,NSE,EQ,EQ,buy,FALSE,2,858.5,77881791,1.30E+15,2021-08-10T12:13:09
MTARTECH,INE864I01014,8/10/2021,NSE,EQ,EQ,buy,FALSE,1,1279.150024,52891614,1.20E+15,2021-08-10T13:20:09
KOTAKBANK,INE237A01028,8/11/2021,NSE,EQ,EQ,sell,FALSE,2,1803,50802435,1.20E+15,2021-08-11T09:39:56
HINDUNILVR,INE030A01027,8/11/2021,NSE,EQ,EQ,buy,FALSE,1,2376.699951,27141530,1.10E+15,2021-08-11T10:35:06
ANURAS,INE930P01018,8/12/2021,NSE,EQ,EQ,buy,FALSE,2,737.349976,1427291,1.00E+15,2021-08-12T10:51:10
HBLPOWER,INE292B01021,8/12/2021,NSE,EQ,EQ,buy,FALSE,2,47.150002,27069244,1.10E+15,2021-08-12T11:13:39
PRAJIND,INE074A01025,8/13/2021,BSE,EQ,T,sell,FALSE,10,350.149994,4936100,1.63E+18,2021-08-13T10:03:26
TATAMOTORS,INE155A01022,8/13/2021,BSE,EQ,A,buy,FALSE,2,308.399994,3551200,1.63E+18,2021-08-13T10:03:50
TATAMOTORS,INE155A01022,8/13/2021,BSE,EQ,A,buy,FALSE,2,308.450012,3551400,1.63E+18,2021-08-13T10:03:50
HBLPOWER,INE292B01021,8/13/2021,BSE,EQ,B,buy,FALSE,3,49.349998,5258200,1.63E+18,2021-08-13T10:04:56
MTARTECH,INE864I01014,8/16/2021,NSE,EQ,EQ,buy,FALSE,1,1308.300049,50567507,1.20E+15,2021-08-16T09:31:21
TATAPOWER,INE245A01021,8/16/2021,NSE,EQ,EQ,buy,FALSE,5,133.149994,77613792,1.30E+15,2021-08-16T11:39:18
TATAMOTORS,INE155A01022,8/20/2021,NSE,EQ,EQ,buy,FALSE,10,287.350006,78607981,1.30E+15,2021-08-20T12:03:09
TATAMOTORS,INE155A01022,8/23/2021,BSE,EQ,A,buy,FALSE,5,282.649994,3719200,1.63E+18,2021-08-23T09:55:53
IDFCFIRSTB,INE092T01019,8/23/2021,BSE,EQ,A,buy,FALSE,30,42.299999,3932800,1.63E+18,2021-08-23T09:58:21
TATAMOTORS,INE155A01022,8/24/2021,BSE,EQ,A,buy,FALSE,5,271.75,7949700,1.63E+18,2021-08-24T11:24:24
CLEAN,INE227W01023,8/25/2021,NSE,EQ,EQ,buy,FALSE,1,1473.199951,1068857,1.00E+15,2021-08-25T10:08:01
ZENTEC,INE251B01027,8/27/2021,NSE,EQ,EQ,buy,FALSE,10,101,75008346,1.30E+15,2021-08-27T09:07:31
ZENTEC,INE251B01027,8/27/2021,NSE,EQ,EQ,buy,FALSE,10,105.050003,75078843,1.30E+15,2021-08-27T09:15:55
TATAPOWER,INE245A01021,8/27/2021,BSE,EQ,A,buy,FALSE,5,125.800003,500400,1.63E+18,2021-08-27T09:34:03
FDC,INE258B01022,8/27/2021,NSE,EQ,EQ,sell,FALSE,2,343.25,25596033,1.10E+15,2021-08-27T09:34:57
LXCHEM,INE576O01020,8/27/2021,BSE,EQ,B,buy,FALSE,8,398.200012,2081400,1.63E+18,2021-08-27T09:40:20
ZENTEC,INE251B01027,8/30/2021,NSE,EQ,EQ,buy,FALSE,5,98.449997,76353782,1.30E+15,2021-08-30T10:11:14
OIL,INE274J01014,8/30/2021,NSE,EQ,EQ,buy,FALSE,1,176,51254484,1.20E+15,2021-08-30T10:17:53
ZENTEC,INE251B01027,8/31/2021,BSE,EQ,B,buy,FALSE,5,95.199997,6216100,1.63E+18,2021-08-31T10:55:53
INDIGO,INE646L01027,9/1/2021,BSE,EQ,A,sell,FALSE,2,1910.900024,1535700,1.63E+18,2021-09-01T10:20:11
ZENTEC,INE251B01027,9/1/2021,NSE,EQ,EQ,buy,FALSE,30,111.849998,77419240,1.30E+15,2021-09-01T11:40:31
LXCHEM,INE576O01020,9/2/2021,BSE,EQ,B,sell,FALSE,25,502.149994,1428400,1.63E+18,2021-09-02T09:21:45
ZENTEC,INE251B01027,9/3/2021,NSE,EQ,EQ,sell,FALSE,20,147.699997,78036067,1.30E+15,2021-09-03T12:15:48
HAPPSTMNDS,INE419U01012,9/6/2021,BSE,EQ,B,sell,FALSE,10,1485,8688700,1.63E+18,2021-09-06T11:01:12
IDFCFIRSTB,INE092T01019,9/8/2021,NSE,EQ,EQ,buy,FALSE,20,47.200001,26538991,1.10E+15,2021-09-08T10:11:13
ITC,INE154A01025,9/9/2021,NSE,EQ,EQ,buy,FALSE,8,211.600006,25891697,1.10E+15,2021-09-09T09:49:36
TATAMOTORS,INE155A01022,9/9/2021,NSE,EQ,EQ,buy,FALSE,15,302.5,76879742,1.30E+15,2021-09-09T11:04:59
M&M,INE101A01026,9/9/2021,NSE,EQ,EQ,buy,FALSE,3,754.150024,51594107,1.20E+15,2021-09-09T11:05:47
PRAJIND,INE074A01025,9/14/2021,NSE,EQ,EQ,sell,FALSE,20,352.850006,50654660,1.20E+15,2021-09-14T09:39:38
AMARAJABAT,INE885A01032,9/14/2021,NSE,EQ,EQ,sell,FALSE,20,737.349976,3361309,1.00E+15,2021-09-14T13:48:02
CLEAN,INE227W01023,9/14/2021,BSE,EQ,B,sell,FALSE,4,1690.949951,3691000,1.63E+18,2021-09-14T13:49:23
OIL,INE274J01014,9/14/2021,BSE,EQ,A,sell,FALSE,1,197.949997,12127000,1.63E+18,2021-09-14T13:50:21
PRAJIND,INE074A01025,9/15/2021,NSE,EQ,EQ,sell,FALSE,7,349.950012,53257671,1.20E+15,2021-09-15T13:32:24
PRAJIND,INE074A01025,9/15/2021,NSE,EQ,EQ,sell,FALSE,13,349.850006,53257672,1.20E+15,2021-09-15T13:32:24
IDFCFIRSTB,INE092T01019,9/16/2021,BSE,EQ,A,buy,FALSE,20,49.349998,924200,1.63E+18,2021-09-16T09:21:31
ONGC,INE213A01029,9/16/2021,NSE,EQ,EQ,buy,FALSE,40,129.399994,51453858,1.20E+15,2021-09-16T10:26:23
IEX,INE022Q01020,9/16/2021,BSE,EQ,A,buy,FALSE,5,607.75,5797500,1.63E+18,2021-09-16T11:22:19
CDSL,INE736A01011,9/17/2021,NSE,EQ,BE,sell,FALSE,2,1350.849976,3396537,1.00E+15,2021-09-17T12:38:43
CDSL,INE736A01011,9/17/2021,NSE,EQ,BE,sell,FALSE,2,1350.5,3396538,1.00E+15,2021-09-17T12:38:43
CDSL,INE736A01011,9/17/2021,NSE,EQ,BE,sell,FALSE,1,1350.349976,3396539,1.00E+15,2021-09-17T12:38:43
TINPLATE,INE422C01014,9/21/2021,NSE,EQ,EQ,buy,FALSE,5,270.850006,78109692,1.30E+15,2021-09-21T12:05:34
JUBLINGREA,INE0BY001018,9/21/2021,NSE,EQ,EQ,buy,FALSE,8,768.900024,53698523,1.20E+15,2021-09-21T13:35:22
JUBLINGREA,INE0BY001018,9/21/2021,NSE,EQ,EQ,buy,FALSE,2,768.900024,53698524,1.20E+15,2021-09-21T13:35:22
ANURAS,INE930P01018,9/27/2021,NSE,EQ,EQ,sell,FALSE,12,764.200012,102580,1.00E+15,2021-09-27T09:16:45
JUBLINGREA,INE0BY001018,9/27/2021,BSE,EQ,B,buy,FALSE,8,755.549988,20389400,1.63E+18,2021-09-27T12:51:03
JUBLINGREA,INE0BY001018,9/27/2021,BSE,EQ,B,buy,FALSE,2,755.650024,20389600,1.63E+18,2021-09-27T12:51:03
DABUR,INE016A01026,9/27/2021,NSE,EQ,EQ,sell,FALSE,1,635.099976,29465655,1.10E+15,2021-09-27T13:10:00
DABUR,INE016A01026,9/27/2021,NSE,EQ,EQ,sell,FALSE,1,635.150024,29465654,1.10E+15,2021-09-27T13:10:00
DABUR,INE016A01026,9/27/2021,NSE,EQ,EQ,sell,FALSE,4,635.099976,29465656,1.10E+15,2021-09-27T13:10:00
DABUR,INE016A01026,9/27/2021,NSE,EQ,EQ,sell,FALSE,1,635.150024,29465653,1.10E+15,2021-09-27T13:10:00
ZENTEC,INE251B01027,9/27/2021,NSE,EQ,EQ,sell,FALSE,20,215.100006,79155062,1.30E+15,2021-09-27T13:11:47
HBLPOWER,INE292B01021,9/28/2021,BSE,EQ,B,sell,FALSE,30,47.25,5953900,1.63E+18,2021-09-28T12:04:38
NHPC,INE848E01016,9/28/2021,NSE,EQ,EQ,buy,FALSE,30,28.25,52789725,1.20E+15,2021-09-28T12:05:33
MANALIPETC,INE201A01024,9/28/2021,NSE,EQ,EQ,buy,FALSE,5,117.5,53048759,1.20E+15,2021-09-28T12:27:30
WIPRO,INE075A01022,9/28/2021,BSE,EQ,A,sell,FALSE,4,640,9106700,1.63E+18,2021-09-28T12:56:49
MTARTECH,INE864I01014,9/28/2021,BSE,EQ,B,sell,FALSE,1,1397.099976,12608500,1.63E+18,2021-09-28T12:59:56
ASIANPAINT,INE021A01026,9/28/2021,NSE,EQ,EQ,sell,FALSE,2,3361.149902,3197852,1.00E+15,2021-09-28T13:00:35
DABUR,INE016A01026,9/28/2021,NSE,EQ,EQ,sell,FALSE,13,622,29492221,1.10E+15,2021-09-28T13:01:27
TATACHEM,INE092A01019,9/28/2021,NSE,EQ,EQ,sell,FALSE,2,906.150024,78598980,1.30E+15,2021-09-28T13:03:16
TATAMOTORS,INE155A01022,9/28/2021,NSE,EQ,EQ,sell,FALSE,5,328.5,78604434,1.30E+15,2021-09-28T13:03:43
SAIL,INE114A01011,9/28/2021,NSE,EQ,EQ,buy,FALSE,50,110.400002,79123377,1.30E+15,2021-09-28T13:46:51
TATASTEEL,INE081A01012,9/28/2021,NSE,EQ,EQ,buy,FALSE,5,1279.150024,79132315,1.30E+15,2021-09-28T13:47:44
JSWSTEEL,INE019A01038,9/28/2021,NSE,EQ,EQ,buy,FALSE,5,662.25,53962545,1.20E+15,2021-09-28T13:48:57
NTPC,INE733E01010,9/29/2021,NSE,EQ,EQ,buy,FALSE,20,131.399994,50009122,1.20E+15,2021-09-29T09:07:22
IEX,INE022Q01020,9/29/2021,BSE,EQ,A,buy,FALSE,10,611.5,2109400,1.63E+18,2021-09-29T09:40:35
TATAPOWER,INE245A01021,9/29/2021,BSE,EQ,A,sell,FALSE,10,152.699997,16078200,1.63E+18,2021-09-29T14:33:17
HINDCOPPER,INE531E01026,9/29/2021,NSE,EQ,EQ,buy,FALSE,3,113.400002,31008957,1.10E+15,2021-09-29T14:56:39
LAOPALA,INE059D01020,9/29/2021,NSE,EQ,EQ,buy,FALSE,10,319.149994,55764855,1.20E+15,2021-09-29T15:20:43
LAOPALA,INE059D01020,9/29/2021,NSE,EQ,EQ,buy,FALSE,5,319.149994,55764856,1.20E+15,2021-09-29T15:20:43
LAOPALA,INE059D01020,9/29/2021,NSE,EQ,EQ,buy,FALSE,4,319.149994,55764857,1.20E+15,2021-09-29T15:20:43
LAOPALA,INE059D01020,9/29/2021,NSE,EQ,EQ,buy,FALSE,11,319.149994,55764854,1.20E+15,2021-09-29T15:20:43
ABFRL,INE647O01011,9/29/2021,NSE,EQ,EQ,buy,FALSE,40,230.850006,5453305,1.00E+15,2021-09-29T15:23:13
ABFRL,INE647O01011,9/30/2021,BSE,EQ,A,sell,FALSE,40,240.100006,691500,1.63E+18,2021-09-30T09:49:26
DABUR,INE016A01026,9/30/2021,NSE,EQ,EQ,sell,FALSE,3,621,28010920,1.10E+15,2021-09-30T11:34:46
M&M,INE101A01026,10/1/2021,NSE,EQ,EQ,sell,FALSE,12,827.549988,54483075,1.20E+15,2021-10-01T15:05:30
NLCINDIA,INE589A01014,10/4/2021,NSE,EQ,EQ,buy,FALSE,50,62.599998,54306661,1.20E+15,2021-10-04T14:43:40
HINDCOPPER,INE531E01026,10/5/2021,BSE,EQ,A,buy,FALSE,5,122.550003,1917700,1.63E+18,2021-10-05T09:55:52
HINDCOPPER,INE531E01026,10/5/2021,BSE,EQ,A,buy,FALSE,12,122.599998,1926900,1.63E+18,2021-10-05T09:56:11
AARTIDRUGS,INE767A01016,10/5/2021,NSE,EQ,EQ,buy,FALSE,1,630.25,1583650,1.00E+15,2021-10-05T10:23:10
AARTIDRUGS,INE767A01016,10/5/2021,NSE,EQ,EQ,buy,FALSE,3,630.400024,1583651,1.00E+15,2021-10-05T10:23:10
AARTIDRUGS,INE767A01016,10/5/2021,NSE,EQ,EQ,buy,FALSE,1,628.25,3070510,1.00E+15,2021-10-05T12:28:49
AARTIDRUGS,INE767A01016,10/5/2021,NSE,EQ,EQ,buy,FALSE,4,628.400024,3075141,1.00E+15,2021-10-05T12:29:21
AARTIDRUGS,INE767A01016,10/5/2021,NSE,EQ,EQ,buy,FALSE,1,628.400024,3075140,1.00E+15,2021-10-05T12:29:21
LAOPALA,INE059D01020,10/5/2021,NSE,EQ,EQ,sell,FALSE,22,320.600006,54409823,1.20E+15,2021-10-05T14:28:51
LAOPALA,INE059D01020,10/5/2021,NSE,EQ,EQ,sell,FALSE,8,320.649994,54409822,1.20E+15,2021-10-05T14:28:51
COALINDIA,INE522F01014,10/6/2021,NSE,EQ,EQ,buy,FALSE,30,195.449997,1970906,1.00E+15,2021-10-06T10:33:34
COALINDIA,INE522F01014,10/6/2021,NSE,EQ,EQ,sell,FALSE,30,195.550003,1977837,1.00E+15,2021-10-06T10:34:06
COALINDIA,INE522F01014,10/6/2021,NSE,EQ,EQ,buy,FALSE,30,195.399994,1983022,1.00E+15,2021-10-06T10:34:26
ADANIPOWER,INE814H01011,10/6/2021,NSE,EQ,EQ,buy,FALSE,30,104.550003,2007884,1.00E+15,2021-10-06T10:36:35
ITC,INE154A01025,10/6/2021,BSE,EQ,A,buy,FALSE,10,234.649994,2400500,1.63E+18,2021-10-06T11:02:11
ONGC,INE213A01029,10/6/2021,BSE,EQ,A,sell,FALSE,10,168.850006,8162700,1.63E+18,2021-10-06T11:51:14
TINPLATE,INE422C01014,10/6/2021,NSE,EQ,EQ,buy,FALSE,10,316.950012,78608504,1.30E+15,2021-10-06T12:19:55
M&M,INE101A01026,10/6/2021,NSE,EQ,EQ,sell,FALSE,6,844.200012,53059321,1.20E+15,2021-10-06T12:38:57
M&M,INE101A01026,10/6/2021,NSE,EQ,EQ,sell,FALSE,7,844.049988,53059322,1.20E+15,2021-10-06T12:38:57
SUNPHARMA,INE044A01036,10/6/2021,NSE,EQ,EQ,buy,FALSE,1,802.25,80375496,1.30E+15,2021-10-06T14:31:04
TATAMOTORS,INE155A01022,10/7/2021,NSE,EQ,EQ,sell,FALSE,54,365.850006,77581082,1.30E+15,2021-10-07T10:44:28
HINDUNILVR,INE030A01027,10/7/2021,NSE,EQ,EQ,sell,FALSE,1,2680.649902,27231825,1.10E+15,2021-10-07T11:01:42
MTARTECH,INE864I01014,10/7/2021,BSE,EQ,B,sell,FALSE,4,1470.300049,6642300,1.63E+18,2021-10-07T11:02:11
BALKRISIND,INE787D01026,10/7/2021,NSE,EQ,EQ,sell,FALSE,1,2559,1790791,1.00E+15,2021-10-07T11:02:32
JSWSTEEL,INE019A01038,10/7/2021,NSE,EQ,EQ,sell,FALSE,5,666.549988,52114675,1.20E+15,2021-10-07T11:03:02
ONGC,INE213A01029,10/7/2021,BSE,EQ,A,sell,FALSE,20,164.050003,4560700,1.63E+18,2021-10-07T11:19:23
ONGC,INE213A01029,10/7/2021,BSE,EQ,A,sell,FALSE,10,164,4560900,1.63E+18,2021-10-07T11:19:23
MANALIPETC,INE201A01024,10/7/2021,BSE,EQ,B,sell,FALSE,5,127.349998,19146400,1.63E+18,2021-10-07T11:19:35
COALINDIA,INE522F01014,10/7/2021,NSE,EQ,EQ,sell,FALSE,30,191.399994,1986637,1.00E+15,2021-10-07T11:19:46
FSL,INE684F01012,10/7/2021,NSE,EQ,EQ,buy,FALSE,20,208.550003,27879360,1.10E+15,2021-10-07T11:50:49
FSL,INE684F01012,10/7/2021,NSE,EQ,EQ,buy,FALSE,2,208.649994,27886767,1.10E+15,2021-10-07T11:51:23
FSL,INE684F01012,10/7/2021,NSE,EQ,EQ,buy,FALSE,28,208.649994,27886768,1.10E+15,2021-10-07T11:51:23
IDFCFIRSTB,INE092T01019,10/7/2021,BSE,EQ,A,buy,FALSE,40,48.150002,8908600,1.63E+18,2021-10-07T12:20:42
SUNPHARMA,INE044A01036,10/7/2021,BSE,EQ,A,sell,FALSE,1,814,4418700,1.63E+18,2021-10-07T13:04:19
FSL,INE684F01012,10/7/2021,NSE,EQ,EQ,buy,FALSE,10,205.949997,30013641,1.10E+15,2021-10-07T14:39:20
L&TFH,INE498L01015,10/8/2021,NSE,EQ,EQ,buy,FALSE,50,91.550003,53927853,1.20E+15,2021-10-08T13:25:31
PEL,INE140A01024,10/8/2021,NSE,EQ,EQ,buy,FALSE,1,2749.449951,54727554,1.20E+15,2021-10-08T14:40:31
NHPC,INE848E01016,10/8/2021,BSE,EQ,A,buy,FALSE,70,30.65,5118500,1.63E+18,2021-10-08T14:53:13
FSL,INE684F01012,10/12/2021,NSE,EQ,EQ,buy,FALSE,10,200.300003,28127507,1.10E+15,2021-10-12T11:17:33
HINDCOPPER,INE531E01026,10/12/2021,NSE,EQ,EQ,buy,FALSE,20,125.800003,28142394,1.10E+15,2021-10-12T11:18:32
ZENTEC,INE251B01027,10/12/2021,NSE,EQ,EQ,buy,FALSE,8,205.850006,80516713,1.30E+15,2021-10-12T13:38:36
ZENTEC,INE251B01027,10/12/2021,NSE,EQ,EQ,buy,FALSE,2,205.850006,80516712,1.30E+15,2021-10-12T13:38:36
PTC,INE877F01012,10/13/2021,NSE,EQ,EQ,buy,FALSE,10,134.600006,50395777,1.20E+15,2021-10-13T09:24:35
TATAMOTORS,INE155A01022,10/14/2021,NSE,EQ,EQ,buy,FALSE,4,516.450012,75597675,1.30E+15,2021-10-14T09:18:30
TATAMOTORS,INE155A01022,10/14/2021,NSE,EQ,EQ,buy,FALSE,5,507.299988,76082470,1.30E+15,2021-10-14T09:24:39
ITC,INE154A01025,10/14/2021,BSE,EQ,A,buy,FALSE,10,252.300003,3796100,1.63E+18,2021-10-14T10:52:10
TINPLATE,INE422C01014,10/14/2021,NSE,EQ,EQ,buy,FALSE,4,336.899994,79647560,1.30E+15,2021-10-14T11:14:48
TINPLATE,INE422C01014,10/14/2021,NSE,EQ,EQ,buy,FALSE,1,336.850006,79647559,1.30E+15,2021-10-14T11:14:48
IDFCFIRSTB,INE092T01019,10/18/2021,NSE,EQ,EQ,buy,FALSE,20,50.349998,26595847,1.10E+15,2021-10-18T09:36:50
FSL,INE684F01012,10/18/2021,BSE,EQ,A,sell,FALSE,70,218.649994,10907100,1.63E+18,2021-10-18T11:56:33
SCI,INE109A01011,10/18/2021,NSE,EQ,EQ,buy,FALSE,8,143,80369252,1.30E+15,2021-10-18T12:10:24
SCI,INE109A01011,10/18/2021,NSE,EQ,EQ,buy,FALSE,12,143,80369253,1.30E+15,2021-10-18T12:10:24
SCI,INE109A01011,10/19/2021,NSE,EQ,EQ,buy,FALSE,10,140.949997,75847283,1.30E+15,2021-10-19T09:25:15
ITC,INE154A01025,10/19/2021,NSE,EQ,EQ,buy,FALSE,10,255.300003,25842684,1.10E+15,2021-10-19T09:28:04
ADANIPOWER,INE814H01011,10/19/2021,BSE,EQ,A,sell,FALSE,30,135.550003,15600500,1.63E+18,2021-10-19T09:30:11
SCI,INE109A01011,10/19/2021,NSE,EQ,EQ,buy,FALSE,10,137.699997,78864009,1.30E+15,2021-10-19T10:39:57
TINPLATE,INE422C01014,10/19/2021,NSE,EQ,EQ,buy,FALSE,20,321.850006,81243212,1.30E+15,2021-10-19T13:07:47
WIPRO,INE075A01022,10/19/2021,NSE,EQ,EQ,buy,FALSE,4,717.299988,83160278,1.30E+15,2021-10-19T14:43:55
IDFCFIRSTB,INE092T01019,10/20/2021,NSE,EQ,EQ,buy,FALSE,20,48.599998,31975607,1.10E+15,2021-10-20T13:16:08
INTELSOFT,INE256F01019,10/21/2021,BSE,EQ,XT,buy,FALSE,20,56.299999,2478100,1.63E+18,2021-10-21T09:42:54
TINPLATE,INE422C01014,10/21/2021,BSE,EQ,A,buy,FALSE,1,312.299988,29893000,1.63E+18,2021-10-21T10:03:21
TINPLATE,INE422C01014,10/21/2021,BSE,EQ,A,buy,FALSE,8,312.450012,29893200,1.63E+18,2021-10-21T10:03:21
TINPLATE,INE422C01014,10/21/2021,BSE,EQ,A,buy,FALSE,1,312.100006,29892800,1.63E+18,2021-10-21T10:03:21
WEBELSOLAR,INE855C01015,10/21/2021,NSE,EQ,EQ,buy,FALSE,10,75.25,77635480,1.30E+15,2021-10-21T10:48:31
UJAAS,INE899L01022,10/21/2021,NSE,EQ,EQ,buy,FALSE,200,3.15,77662997,1.30E+15,2021-10-21T10:49:56
WEBELSOLAR,INE855C01015,10/21/2021,NSE,EQ,EQ,buy,FALSE,20,75.150002,77672299,1.30E+15,2021-10-21T10:50:26
SURANASOL,INE272L01022,10/21/2021,NSE,EQ,BE,buy,FALSE,10,21,77708577,1.30E+15,2021-10-21T10:52:31
URJA,INE550C01020,10/21/2021,NSE,EQ,EQ,buy,FALSE,20,7.9,77732079,1.30E+15,2021-10-21T10:54:02
SUZLON,INE040H01021,10/21/2021,NSE,EQ,EQ,buy,FALSE,100,7.1,77760693,1.30E+15,2021-10-21T10:55:55
JUBLINGREA,INE0BY001018,10/22/2021,BSE,EQ,B,buy,FALSE,5,685,10904200,1.63E+18,2021-10-22T10:07:29
DEEPAKNTR,INE288B01029,10/22/2021,NSE,EQ,EQ,buy,FALSE,2,2462.949951,26961705,1.10E+15,2021-10-22T10:09:25
LAURUSLABS,INE947Q01028,10/22/2021,NSE,EQ,EQ,buy,FALSE,3,549.799988,51732434,1.20E+15,2021-10-22T10:35:41
LAURUSLABS,INE947Q01028,10/26/2021,BSE,EQ,A,buy,FALSE,1,564.450012,2261200,1.64E+18,2021-10-26T09:46:00
LAURUSLABS,INE947Q01028,10/26/2021,BSE,EQ,A,buy,FALSE,1,564.400024,2261000,1.64E+18,2021-10-26T09:46:00
JUBLINGREA,INE0BY001018,10/26/2021,NSE,EQ,EQ,buy,FALSE,5,657.299988,50859592,1.20E+15,2021-10-26T09:46:57
TATAMOTORS,INE155A01022,10/26/2021,NSE,EQ,EQ,buy,FALSE,5,493,76367771,1.30E+15,2021-10-26T09:48:45
IEX,INE022Q01020,10/26/2021,BSE,EQ,A,buy,FALSE,2,745.950012,5322400,1.64E+18,2021-10-26T09:49:48
HINDCOPPER,INE531E01026,10/26/2021,NSE,EQ,EQ,buy,FALSE,5,132.25,27243337,1.10E+15,2021-10-26T10:27:54
SCI,INE109A01011,10/26/2021,NSE,EQ,EQ,buy,FALSE,5,131.199997,78105124,1.30E+15,2021-10-26T11:18:14
SCI,INE109A01011,10/26/2021,NSE,EQ,EQ,sell,FALSE,5,131.050003,78110556,1.30E+15,2021-10-26T11:18:47
SCI,INE109A01011,10/26/2021,NSE,EQ,EQ,buy,FALSE,5,131.300003,80030513,1.30E+15,2021-10-26T13:50:18
L&TFH,INE498L01015,10/26/2021,NSE,EQ,EQ,buy,FALSE,5,84.5,53721225,1.20E+15,2021-10-26T13:57:15
IDFCFIRSTB,INE092T01019,11/1/2021,BSE,EQ,A,buy,FALSE,20,49.549999,6812800,1.64E+18,2021-11-01T10:31:13
TRENT,INE849A01020,11/1/2021,NSE,EQ,EQ,buy,FALSE,2,1004,77264696,1.30E+15,2021-11-01T10:31:53
TINPLATE,INE422C01014,11/1/2021,NSE,EQ,EQ,buy,FALSE,3,298.350006,77268831,1.30E+15,2021-11-01T10:32:12
TINPLATE,INE422C01014,11/1/2021,NSE,EQ,EQ,buy,FALSE,2,298.299988,77268830,1.30E+15,2021-11-01T10:32:12
DEEPAKNI,INE288B01029,11/1/2021,BSE,EQ,A,buy,FALSE,1,2261.199951,1872000,1.64E+18,2021-11-01T10:32:56
SCI,INE109A01011,11/1/2021,NSE,EQ,EQ,buy,FALSE,15,131,77286119,1.30E+15,2021-11-01T10:33:25
INFY,INE009A01021,11/1/2021,BSE,EQ,A,buy,FALSE,1,1700.199951,5067500,1.64E+18,2021-11-01T10:33:49
PTC,INE877F01012,11/1/2021,NSE,EQ,EQ,buy,FALSE,10,126.400002,51521913,1.20E+15,2021-11-01T10:34:27
TATAMOTORS,INE155A01022,11/1/2021,BSE,EQ,A,buy,FALSE,5,480.450012,6954000,1.64E+18,2021-11-01T10:34:37
IRCTC,INE335Y01020,11/2/2021,NSE,EQ,EQ,buy,FALSE,5,863.150024,25090571,1.10E+15,2021-11-02T09:15:45
TATACHEM,INE092A01019,11/2/2021,NSE,EQ,EQ,buy,FALSE,5,911.25,75264870,1.30E+15,2021-11-02T09:17:39
AARTIDRUGS,INE767A01016,11/2/2021,BSE,EQ,A,buy,FALSE,5,582.5,2618000,1.64E+18,2021-11-02T09:18:41
DEEPAKNI,INE288B01029,11/3/2021,BSE,EQ,A,buy,FALSE,1,2278.100098,1668800,1.64E+18,2021-11-03T10:52:07
JUBLINGREA,INE0BY001018,11/23/2021,BSE,EQ,B,buy,FALSE,5,564.950012,7004300,1.64E+18,2021-11-23T09:30:16
IDFCFIRSTB,INE092T01019,11/23/2021,BSE,EQ,A,buy,FALSE,20,47.400002,10366400,1.64E+18,2021-11-23T09:30:35
JUBLINGREA,INE0BY001018,11/23/2021,BSE,EQ,B,buy,FALSE,5,568.900024,14086200,1.64E+18,2021-11-23T09:52:57
IDFCFIRSTB,INE092T01019,11/23/2021,BSE,EQ,A,buy,FALSE,20,47.799999,15835300,1.64E+18,2021-11-23T09:53:22
TINPLATE,INE422C01014,11/23/2021,BSE,EQ,A,buy,FALSE,5,287.5,20495200,1.64E+18,2021-11-23T09:59:17
DEEPAKNI,INE288B01029,11/23/2021,BSE,EQ,A,buy,FALSE,1,2132.449951,2289200,1.64E+18,2021-11-23T09:59:26
PEL,INE140A01024,11/23/2021,NSE,EQ,EQ,buy,FALSE,1,2632,51345464,1.20E+15,2021-11-23T09:59:46
IRCTC,INE335Y01020,11/23/2021,NSE,EQ,EQ,buy,FALSE,5,892.200012,26495156,1.10E+15,2021-11-23T10:00:38
HINDCOPPER,INE531E01026,11/23/2021,NSE,EQ,EQ,buy,FALSE,1,118.75,26541183,1.10E+15,2021-11-23T10:02:29
HINDCOPPER,INE531E01026,11/23/2021,NSE,EQ,EQ,buy,FALSE,14,118.75,26541184,1.10E+15,2021-11-23T10:02:29
LAURUSLABS,INE947Q01028,11/23/2021,BSE,EQ,A,buy,FALSE,5,481.100006,2163100,1.64E+18,2021-11-23T10:02:50
ZENTEC,INE251B01027,11/23/2021,NSE,EQ,EQ,buy,FALSE,20,208.649994,79146262,1.30E+15,2021-11-23T12:39:01
IDFCFIRSTB,INE092T01019,11/29/2021,BSE,EQ,A,buy,FALSE,10,46.299999,13936700,1.64E+18,2021-11-29T10:18:15
TINPLATE,INE422C01014,11/29/2021,NSE,EQ,EQ,buy,FALSE,10,276.649994,78347277,1.30E+15,2021-11-29T10:18:28
IDFCFIRSTB,INE092T01019,11/30/2021,BSE,EQ,A,buy,FALSE,10,45.200001,6439800,1.64E+18,2021-11-30T12:30:32
IEX,INE022Q01020,12/13/2021,BSE,EQ,A,buy,FALSE,4,298.899994,1198100,1.64E+18,2021-12-13T09:19:29
IEX,INE022Q01020,12/17/2021,NSE,EQ,EQ,sell,FALSE,33,257.299988,27552183,1.10E+15,2021-12-17T10:53:56
CDSL,INE736A01011,12/17/2021,NSE,EQ,EQ,buy,FALSE,1,1568.199951,1805792,1.00E+15,2021-12-17T11:02:21
INFY,INE009A01021,12/17/2021,NSE,EQ,EQ,buy,FALSE,1,1824.699951,28004535,1.10E+15,2021-12-17T11:29:16
WIPRO,INE075A01022,12/17/2021,NSE,EQ,EQ,buy,FALSE,2,654.150024,78263992,1.30E+15,2021-12-17T11:29:28
TATACHEM,INE092A01019,12/17/2021,BSE,EQ,A,buy,FALSE,2,890.900024,43521700,1.64E+18,2021-12-17T11:29:50
IDFCFIRSTB,INE092T01019,12/22/2021,BSE,EQ,A,buy,FALSE,40,46.450001,2771600,1.64E+18,2021-12-22T10:21:13
ITC,INE154A01025,12/22/2021,NSE,EQ,EQ,buy,FALSE,1,212,26799260,1.10E+15,2021-12-22T11:13:01
CENTURYTEX,INE055A01016,12/23/2021,NSE,EQ,EQ,buy,FALSE,5,897.549988,420884,1.00E+15,2021-12-23T09:33:35
URJAGLOBA,INE550C01020,12/23/2021,BSE,EQ,B,sell,FALSE,10,16.139999,6841700,1.64E+18,2021-12-23T09:38:02
TATACHEM,INE092A01019,12/23/2021,BSE,EQ,A,buy,FALSE,3,887.5,35420600,1.64E+18,2021-12-23T11:25:08
ITC,INE154A01025,12/23/2021,BSE,EQ,A,buy,FALSE,9,216.75,2758600,1.64E+18,2021-12-23T11:36:17
SUZLON,INE040H01021,12/24/2021,BSE,EQ,A,sell,FALSE,100,7.68,50231800,1.64E+18,2021-12-24T12:09:37
JUBLINGREA,INE0BY001018,12/27/2021,BSE,EQ,A,buy,FALSE,3,527.400024,46163000,1.64E+18,2021-12-27T12:21:36
LAURUSLABS,INE947Q01028,12/27/2021,NSE,EQ,EQ,buy,FALSE,5,520.200012,52075814,1.20E+15,2021-12-27T12:42:26
SURANASOL,INE272L01022,12/27/2021,BSE,EQ,T,sell,FALSE,10,29.9,8843600,1.64E+18,2021-12-27T13:31:17
HINDCOPPER,INE531E01026,12/28/2021,NSE,EQ,EQ,buy,FALSE,10,118.349998,25029846,1.10E+15,2021-12-28T09:15:06
TATAMOTORS,INE155A01022,12/28/2021,BSE,EQ,A,buy,FALSE,3,475.899994,94900,1.64E+18,2021-12-28T09:15:39
DEVYANI,INE872J01023,12/28/2021,NSE,EQ,EQ,buy,FALSE,2,166.050003,25084959,1.10E+15,2021-12-28T09:16:17
DEVYANI,INE872J01023,12/28/2021,NSE,EQ,EQ,buy,FALSE,23,171.350006,25777036,1.10E+15,2021-12-28T09:46:37
MAPMYINDIA,INE0BV301023,12/29/2021,NSE,EQ,EQ,buy,FALSE,1,1659.650024,50409989,1.20E+15,2021-12-29T09:28:26
XELPMOC,INE01P501012,12/29/2021,NSE,EQ,EQ,buy,FALSE,1,407.299988,75560460,1.30E+15,2021-12-29T09:29:41
OIL,INE274J01014,12/29/2021,NSE,EQ,EQ,buy,FALSE,10,189.699997,50500799,1.20E+15,2021-12-29T09:32:49
PRAJIND,INE074A01025,12/29/2021,NSE,EQ,EQ,buy,FALSE,5,335.850006,50603704,1.20E+15,2021-12-29T09:38:11
XELPMOC,INE01P501012,12/29/2021,NSE,EQ,EQ,buy,FALSE,3,412.600006,75777591,1.30E+15,2021-12-29T09:39:26
ZOMATO,INE758T01015,12/29/2021,NSE,EQ,EQ,buy,FALSE,1,132.949997,76179249,1.30E+15,2021-12-29T10:02:31
NYKAA,INE388Y01029,12/29/2021,NSE,EQ,EQ,buy,FALSE,1,2118.600098,51053381,1.20E+15,2021-12-29T10:07:12
NYKAA,INE388Y01029,12/29/2021,NSE,EQ,EQ,buy,FALSE,3,2121,51148883,1.20E+15,2021-12-29T10:14:03
MARICO,INE196A01026,12/29/2021,NSE,EQ,EQ,buy,FALSE,3,502.399994,51191838,1.20E+15,2021-12-29T10:16:10
BALRAMCHIN,INE119A01028,12/29/2021,NSE,EQ,EQ,buy,FALSE,10,356.450012,1015347,1.00E+15,2021-12-29T10:24:56
RELIANCE,INE002A01018,12/29/2021,NSE,EQ,EQ,buy,FALSE,1,2404.449951,76626156,1.30E+15,2021-12-29T10:30:20
IOC,INE242A01010,12/29/2021,NSE,EQ,EQ,buy,FALSE,15,111.300003,26267726,1.10E+15,2021-12-29T10:33:40
GAIL,INE129A01019,12/29/2021,BSE,EQ,A,buy,FALSE,10,131.600006,1643500,1.64E+18,2021-12-29T10:35:05
NTPC,INE733E01010,12/29/2021,BSE,EQ,A,buy,FALSE,9,123.949997,2306400,1.64E+18,2021-12-29T10:35:41
JUBLINGREA,INE0BY001018,12/29/2021,BSE,EQ,A,buy,FALSE,2,548.950012,36636800,1.64E+18,2021-12-29T10:39:53
NTPC,INE733E01010,12/29/2021,BSE,EQ,A,buy,FALSE,11,124.25,2473900,1.64E+18,2021-12-29T10:45:01
TRIVENI,INE256C01024,12/29/2021,NSE,EQ,EQ,buy,FALSE,10,225.449997,77218295,1.30E+15,2021-12-29T11:15:12
SHAREINDIA,INE932X01018,12/31/2021,NSE,EQ,EQ,buy,FALSE,1,1066.800049,77281544,1.30E+15,2021-12-31T11:35:31
SHAREINDIA,INE932X01018,12/31/2021,NSE,EQ,EQ,buy,FALSE,1,1066.849976,77281545,1.30E+15,2021-12-31T11:35:31
ZENSARTECH,INE520A01027,12/31/2021,NSE,EQ,EQ,buy,FALSE,2,520,77297384,1.30E+15,2021-12-31T11:37:09
HINDCOPPER,INE531E01026,12/31/2021,BSE,EQ,A,buy,FALSE,10,125.5,2895700,1.64E+18,2021-12-31T11:40:08
SCI,INE109A01011,12/31/2021,NSE,EQ,EQ,buy,FALSE,5,135.800003,77332648,1.30E+15,2021-12-31T11:40:56
ZOMATO,INE758T01015,1/3/2022,BSE,EQ,B,buy,FALSE,9,141.199997,12353700,1.64E+18,2022-01-03T13:27:42
ZENSARTECH,INE520A01027,1/3/2022,NSE,EQ,EQ,buy,FALSE,3,532.5,79167282,1.30E+15,2022-01-03T13:48:33
MARICO,INE196A01026,1/3/2022,NSE,EQ,EQ,buy,FALSE,2,514.950012,53196850,1.20E+15,2022-01-03T13:49:03
MOREPENLAB,INE083A01026,1/4/2022,NSE,EQ,EQ,buy,FALSE,50,57.5,51903376,1.20E+15,2022-01-04T10:39:11
AVANTIFEED,INE871C01038,1/4/2022,NSE,EQ,EQ,buy,FALSE,10,578.5,2369100,1.00E+15,2022-01-04T11:24:00
XELPMOC,INE01P501012,1/4/2022,NSE,EQ,EQ,buy,FALSE,1,392.549988,78049736,1.30E+15,2022-01-04T11:24:54
PTC,INE877F01012,1/4/2022,BSE,EQ,A,buy,FALSE,20,111.449997,2929600,1.64E+18,2022-01-04T11:47:29
PTC,INE877F01012,1/4/2022,BSE,EQ,A,buy,FALSE,10,111.449997,2932000,1.64E+18,2022-01-04T11:47:52
DLINKINDIA,INE250K01012,1/4/2022,NSE,EQ,EQ,buy,FALSE,5,180,28123614,1.10E+15,2022-01-04T12:25:30
DWARKESH,INE366A01041,1/5/2022,NSE,EQ,EQ,buy,FALSE,40,89.400002,25109012,1.10E+15,2022-01-05T09:15:40
DWARKESH,INE366A01041,1/5/2022,NSE,EQ,EQ,buy,FALSE,10,88.199997,25293294,1.10E+15,2022-01-05T09:19:42
DWARKESH,INE366A01041,1/5/2022,NSE,EQ,EQ,buy,FALSE,20,87,25325315,1.10E+15,2022-01-05T09:20:35
DWARKESH,INE366A01041,1/5/2022,NSE,EQ,EQ,buy,FALSE,10,85.550003,25705863,1.10E+15,2022-01-05T09:32:24
DWARKESH,INE366A01041,1/5/2022,NSE,EQ,EQ,buy,FALSE,10,86.75,27366216,1.10E+15,2022-01-05T11:03:45
DWARKESH,INE366A01041,1/5/2022,NSE,EQ,EQ,buy,FALSE,10,86.349998,27560425,1.10E+15,2022-01-05T11:18:56
NAZARA,INE418L01021,1/5/2022,BSE,EQ,B,buy,FALSE,1,2489.850098,39396000,1.64E+18,2022-01-05T11:59:52
DALMIASUG,INE495A01022,1/5/2022,NSE,EQ,EQ,buy,FALSE,2,424.350006,28921418,1.10E+15,2022-01-05T13:03:46
DALMIASUG,INE495A01022,1/5/2022,NSE,EQ,EQ,buy,FALSE,3,424.399994,28921420,1.10E+15,2022-01-05T13:03:46
DALMIASUG,INE495A01022,1/5/2022,NSE,EQ,EQ,buy,FALSE,5,424.350006,28921419,1.10E+15,2022-01-05T13:03:46
TRIVENI,INE256C01024,1/5/2022,NSE,EQ,EQ,buy,FALSE,10,245.25,78606869,1.30E+15,2022-01-05T13:08:14
DABUR,INE016A01026,1/5/2022,NSE,EQ,EQ,buy,FALSE,3,580.450012,29016393,1.10E+15,2022-01-05T13:10:56
TRIVENI,INE256C01024,1/5/2022,BSE,EQ,A,buy,FALSE,10,245.449997,88277700,1.64E+18,2022-01-05T13:11:23
TATAPOWER,INE245A01021,1/5/2022,NSE,EQ,EQ,buy,FALSE,10,223.5,80719707,1.30E+15,2022-01-05T15:51:37
TIPSINDLTD,INE716B01011,1/6/2022,NSE,EQ,BE,buy,FALSE,1,2149,75422282,1.30E+15,2022-01-06T09:21:50
ACRYSIL,INE482D01024,1/6/2022,NSE,EQ,EQ,buy,FALSE,1,818.950012,530674,1.00E+15,2022-01-06T09:30:56
KHAICHEM,INE745B01028,1/6/2022,NSE,EQ,EQ,buy,FALSE,10,66.599998,51958978,1.20E+15,2022-01-06T11:06:34
KHAICHEM,INE745B01028,1/6/2022,NSE,EQ,EQ,buy,FALSE,6,66.599998,51961150,1.20E+15,2022-01-06T11:06:48
KHAICHEM,INE745B01028,1/6/2022,NSE,EQ,EQ,buy,FALSE,8,66.599998,51961153,1.20E+15,2022-01-06T11:06:48
KHAICHEM,INE745B01028,1/6/2022,NSE,EQ,EQ,buy,FALSE,6,66.599998,51961151,1.20E+15,2022-01-06T11:06:48
KHAICHEM,INE745B01028,1/6/2022,NSE,EQ,EQ,buy,FALSE,5,66.699997,52026235,1.20E+15,2022-01-06T11:14:05
KHAICHEM,INE745B01028,1/6/2022,NSE,EQ,EQ,buy,FALSE,25,66.75,52026236,1.20E+15,2022-01-06T11:14:05
MARICO,INE196A01026,1/6/2022,BSE,EQ,A,buy,FALSE,3,503,3196400,1.64E+18,2022-01-06T11:52:34
L&TFH,INE498L01015,1/6/2022,BSE,EQ,A,sell,FALSE,55,80.099998,4040300,1.64E+18,2022-01-06T11:56:08
INTELSOFT,INE256F01019,1/6/2022,BSE,EQ,XT,sell,FALSE,20,31.1,17092100,1.64E+18,2022-01-06T11:56:38
NYKAA,INE388Y01029,1/6/2022,BSE,EQ,B,buy,FALSE,1,2001.650024,9417500,1.64E+18,2022-01-06T11:58:06
TATAMOTORS,INE155A01022,1/6/2022,NSE,EQ,EQ,buy,FALSE,2,485.200012,78110718,1.30E+15,2022-01-06T11:58:39
HINDCOPPER,INE531E01026,1/6/2022,BSE,EQ,A,buy,FALSE,4,131.75,4088500,1.64E+18,2022-01-06T12:12:39
HINDCOPPER,INE531E01026,1/6/2022,BSE,EQ,A,buy,FALSE,1,131.699997,4088300,1.64E+18,2022-01-06T12:12:39
MANAKSIA,INE015D01022,1/7/2022,NSE,EQ,EQ,buy,FALSE,9,80.099998,50741629,1.20E+15,2022-01-07T09:35:50
MANAKSIA,INE015D01022,1/7/2022,NSE,EQ,EQ,buy,FALSE,1,80.050003,50741628,1.20E+15,2022-01-07T09:35:50
MANAKSTEEL,INE824Q01011,1/7/2022,NSE,EQ,EQ,buy,FALSE,13,48.75,50752176,1.20E+15,2022-01-07T09:36:17
ZOMATO,INE758T01015,1/7/2022,BSE,EQ,B,buy,FALSE,10,129.600006,2513800,1.64E+18,2022-01-07T09:38:47
ZENSARTECH,INE520A01027,1/7/2022,NSE,EQ,EQ,buy,FALSE,2,505.700012,75963497,1.30E+15,2022-01-07T09:39:11
ACRYSIL,INE482D01024,1/10/2022,BSE,EQ,A,buy,FALSE,2,823.099976,17699300,1.64E+18,2022-01-10T09:27:48
TATAPOWER,INE245A01021,1/10/2022,NSE,EQ,EQ,buy,FALSE,10,230.949997,75752902,1.30E+15,2022-01-10T09:29:21
BSE,INE118H01025,1/10/2022,NSE,EQ,EQ,buy,FALSE,1,1956,501333,1.00E+15,2022-01-10T09:31:30
ZENSARTECH,INE520A01027,1/10/2022,BSE,EQ,A,buy,FALSE,3,497.950012,896200,1.64E+18,2022-01-10T09:35:38
CDSL,INE736A01011,1/10/2022,NSE,EQ,EQ,buy,FALSE,1,1557.400024,593490,1.00E+15,2022-01-10T09:36:35
OIL,INE274J01014,1/10/2022,NSE,EQ,EQ,buy,FALSE,5,216.449997,50951547,1.20E+15,2022-01-10T09:39:39
DALMIASUG,INE495A01022,1/10/2022,NSE,EQ,EQ,sell,FALSE,10,429.200012,26501851,1.10E+15,2022-01-10T10:05:08
IOC,INE242A01010,1/10/2022,BSE,EQ,A,sell,FALSE,15,119.349998,2179900,1.64E+18,2022-01-10T10:05:32
NHPC,INE848E01016,1/10/2022,BSE,EQ,A,sell,FALSE,100,31.450001,1294400,1.64E+18,2022-01-10T10:05:47
DWARKESH,INE366A01041,1/10/2022,BSE,EQ,A,buy,FALSE,10,88.949997,44909300,1.64E+18,2022-01-10T10:15:47
OIL,INE274J01014,1/10/2022,NSE,EQ,EQ,sell,FALSE,10,216.399994,51829438,1.20E+15,2022-01-10T10:30:09
KHAICHEM,INE745B01028,1/10/2022,NSE,EQ,EQ,buy,FALSE,13,72.900002,51962831,1.20E+15,2022-01-10T10:37:35
OIL,INE274J01014,1/10/2022,NSE,EQ,EQ,sell,FALSE,5,217.300003,52109945,1.20E+15,2022-01-10T10:45:34
JUBLINGREA,INE0BY001018,1/10/2022,NSE,EQ,EQ,buy,FALSE,4,596.400024,52984113,1.20E+15,2022-01-10T11:59:15
JUBLINGREA,INE0BY001018,1/10/2022,NSE,EQ,EQ,buy,FALSE,1,596.349976,52984112,1.20E+15,2022-01-10T11:59:15
TATAPOWER,INE245A01021,1/10/2022,NSE,EQ,EQ,buy,FALSE,20,231.699997,78446468,1.30E+15,2022-01-10T12:00:09
LATENTVIEW,INE0I7C01011,1/11/2022,NSE,EQ,EQ,buy,FALSE,6,588,50009122,1.20E+15,2022-01-11T09:07:20
GREAVESCOT,INE224A01026,1/11/2022,NSE,EQ,EQ,buy,FALSE,20,207.199997,25234990,1.10E+15,2022-01-11T09:17:38
PRAJIND,INE074A01025,1/11/2022,NSE,EQ,EQ,sell,FALSE,5,378.25,50452247,1.20E+15,2022-01-11T09:21:26
CDSL,INE736A01011,1/11/2022,NSE,EQ,EQ,buy,FALSE,1,1542.849976,360812,1.00E+15,2022-01-11T09:23:46
ZENTEC,INE251B01027,1/11/2022,NSE,EQ,EQ,buy,FALSE,1,221.600006,75617685,1.30E+15,2022-01-11T09:24:21
MANAKSIA,INE015D01022,1/11/2022,BSE,EQ,B,sell,FALSE,8,78.699997,10905100,1.64E+18,2022-01-11T09:31:06
MANAKSIA,INE015D01022,1/11/2022,BSE,EQ,B,sell,FALSE,2,78.75,10904900,1.64E+18,2022-01-11T09:31:06
MANAKSTEEL,INE824Q01011,1/11/2022,NSE,EQ,EQ,sell,FALSE,13,42.900002,50827117,1.20E+15,2022-01-11T09:31:16
RAIN,INE855B01025,1/11/2022,NSE,EQ,EQ,buy,FALSE,7,238.149994,76751936,1.30E+15,2022-01-11T10:01:08
RAIN,INE855B01025,1/11/2022,NSE,EQ,EQ,buy,FALSE,13,237.899994,76918283,1.30E+15,2022-01-11T10:10:31
HINDCOPPER,INE531E01026,1/11/2022,NSE,EQ,EQ,buy,FALSE,1,131.449997,28523228,1.10E+15,2022-01-11T11:49:50
HINDCOPPER,INE531E01026,1/11/2022,NSE,EQ,EQ,buy,FALSE,14,131.449997,28526084,1.10E+15,2022-01-11T11:50:02
CEREBRAINT,INE345B01019,1/11/2022,NSE,EQ,EQ,buy,FALSE,30,95.75,2395374,1.00E+15,2022-01-11T11:52:22
RAMKY,INE874I01013,1/11/2022,NSE,EQ,EQ,buy,FALSE,1,227.75,81771780,1.30E+15,2022-01-11T15:17:49
RAMKY,INE874I01013,1/11/2022,NSE,EQ,EQ,buy,FALSE,8,227.800003,81771781,1.30E+15,2022-01-11T15:17:49
WEBELSOLAR,INE855C01015,1/12/2022,BSE,EQ,B,sell,FALSE,30,143.25,15030600,1.64E+18,2022-01-12T09:41:01
CENTURYTEX,INE055A01016,1/12/2022,BSE,EQ,A,buy,FALSE,2,1009.549988,1156900,1.64E+18,2022-01-12T09:42:36
ZENSARTECH,INE520A01027,1/12/2022,BSE,EQ,A,buy,FALSE,4,495.700012,1184500,1.64E+18,2022-01-12T09:45:46
UJAAS,INE899L01022,1/12/2022,BSE,EQ,B,buy,FALSE,10,6.09,39599000,1.64E+18,2022-01-12T11:08:35
CEREBRAINT,INE345B01019,1/14/2022,NSE,EQ,EQ,buy,FALSE,8,89.599998,2146207,1.00E+15,2022-01-14T11:57:15
GAIL,INE129A01019,1/14/2022,BSE,EQ,A,sell,FALSE,10,144.350006,1911000,1.64E+18,2022-01-14T11:59:51
BALRAMCHIN,INE119A01028,1/14/2022,NSE,EQ,EQ,buy,FALSE,2,442.450012,2181404,1.00E+15,2022-01-14T12:01:14
PTC,INE877F01012,1/17/2022,NSE,EQ,EQ,sell,FALSE,50,110.050003,51481896,1.20E+15,2022-01-17T10:00:23
HFCL,INE548A01028,1/17/2022,NSE,EQ,EQ,buy,FALSE,50,97.650002,26726157,1.10E+15,2022-01-17T10:01:17
DLINKINDIA,INE250K01012,1/17/2022,NSE,EQ,EQ,sell,FALSE,1,176.949997,26744349,1.10E+15,2022-01-17T10:02:08
DLINKINDIA,INE250K01012,1/17/2022,NSE,EQ,EQ,sell,FALSE,4,176.949997,26744348,1.10E+15,2022-01-17T10:02:08
LATENTVIEW,INE0I7C01011,1/17/2022,BSE,EQ,B,sell,FALSE,2,603.900024,1385300,1.64E+18,2022-01-17T10:02:39
LATENTVIEW,INE0I7C01011,1/17/2022,BSE,EQ,B,sell,FALSE,4,603.950012,1385100,1.64E+18,2022-01-17T10:02:39
MOREPENLAB,INE083A01026,1/17/2022,BSE,EQ,A,sell,FALSE,50,54.849998,48063200,1.64E+18,2022-01-17T10:13:12
CEREBRAINT,INE345B01019,1/17/2022,BSE,EQ,A,buy,FALSE,12,90.400002,50078300,1.64E+18,2022-01-17T10:17:55
ZENSARTECH,INE520A01027,1/17/2022,BSE,EQ,A,buy,FALSE,3,477.700012,1089300,1.64E+18,2022-01-17T10:18:39
ZENSARTECH,INE520A01027,1/17/2022,BSE,EQ,A,buy,FALSE,2,477.649994,1089100,1.64E+18,2022-01-17T10:18:39
RAIN,INE855B01025,1/17/2022,NSE,EQ,EQ,sell,FALSE,4,242.600006,76983010,1.30E+15,2022-01-17T10:19:41
RAIN,INE855B01025,1/17/2022,NSE,EQ,EQ,sell,FALSE,1,242.600006,76983009,1.30E+15,2022-01-17T10:19:41
RAIN,INE855B01025,1/17/2022,NSE,EQ,EQ,sell,FALSE,15,242.600006,76983008,1.30E+15,2022-01-17T10:19:41
RAMKY,INE874I01013,1/17/2022,BSE,EQ,B,sell,FALSE,9,234,24502900,1.64E+18,2022-01-17T10:20:17
BSE,INE118H01025,1/17/2022,NSE,EQ,EQ,buy,FALSE,1,2061.25,1326156,1.00E+15,2022-01-17T10:20:25
LAURUSLABS,INE947Q01028,1/17/2022,BSE,EQ,A,buy,FALSE,3,511.549988,3141300,1.64E+18,2022-01-17T10:21:52
HAPPSTMNDS,INE419U01012,1/17/2022,BSE,EQ,B,buy,FALSE,1,1334,25148400,1.64E+18,2022-01-17T10:23:39
HFCL,INE548A01028,1/17/2022,NSE,EQ,EQ,buy,FALSE,10,96.900002,27419289,1.10E+15,2022-01-17T10:44:56
AVANTIFEED,INE871C01038,1/17/2022,NSE,EQ,EQ,sell,FALSE,10,621.349976,2793192,1.00E+15,2022-01-17T12:33:55
RELIANCE,INE002A01018,1/17/2022,NSE,EQ,EQ,sell,FALSE,1,2561.449951,78883986,1.30E+15,2022-01-17T12:34:17
PRAJIND,INE074A01025,1/17/2022,NSE,EQ,EQ,buy,FALSE,10,433,53503599,1.20E+15,2022-01-17T12:35:25
GREAVESCOT,INE224A01026,1/18/2022,NSE,EQ,EQ,buy,FALSE,10,247,25403307,1.10E+15,2022-01-18T09:21:20
BALRAMCHIN,INE119A01028,1/18/2022,NSE,EQ,EQ,buy,FALSE,8,449.399994,303947,1.00E+15,2022-01-18T09:21:50
WIPRO,INE075A01022,1/18/2022,NSE,EQ,EQ,buy,FALSE,3,647.799988,75525715,1.30E+15,2022-01-18T09:22:08
INFY,INE009A01021,1/18/2022,NSE,EQ,EQ,buy,FALSE,1,1940.949951,25448417,1.10E+15,2022-01-18T09:22:19
KHAICHEM,INE745B01028,1/18/2022,BSE,EQ,B,buy,FALSE,4,99.400002,1234700,1.64E+18,2022-01-18T09:23:19
TRIDENT,INE064C01022,1/18/2022,NSE,EQ,EQ,buy,FALSE,50,65.400002,76284861,1.30E+15,2022-01-18T09:42:28
KPITTECH,INE04I401011,1/18/2022,NSE,EQ,EQ,buy,FALSE,5,717,51112904,1.20E+15,2022-01-18T09:43:49
DEVYANI,INE872J01023,1/18/2022,NSE,EQ,EQ,buy,FALSE,15,192.350006,27655650,1.10E+15,2022-01-18T11:05:16
HFCL,INE548A01028,1/18/2022,BSE,EQ,A,buy,FALSE,3,91.349998,87889500,1.64E+18,2022-01-18T11:49:01
TATAELXSI,INE670A01012,1/24/2022,NSE,EQ,EQ,buy,FALSE,1,7236.950195,77778676,1.30E+15,2022-01-24T10:23:16
CDSL,INE736A01011,1/24/2022,NSE,EQ,EQ,buy,FALSE,2,1531.150024,1761771,1.00E+15,2022-01-24T10:25:55
SHAREINDIA,INE932X01018,1/24/2022,BSE,EQ,B,sell,FALSE,2,1205,2094900,1.64E+18,2022-01-24T10:27:13
TRENT,INE849A01020,1/24/2022,NSE,EQ,EQ,sell,FALSE,2,1149.349976,77933746,1.30E+15,2022-01-24T10:29:00
TATAPOWER,INE245A01021,1/24/2022,BSE,EQ,A,buy,FALSE,10,234.449997,5942900,1.64E+18,2022-01-24T10:29:26
TIPSINDLTD,INE716B01011,1/24/2022,BSE,EQ,T,buy,FALSE,2,2136.25,8461400,1.64E+18,2022-01-24T10:31:49
TINPLATE,INE422C01014,1/24/2022,BSE,EQ,A,sell,FALSE,7,376.850006,67897300,1.64E+18,2022-01-24T10:34:42
TINPLATE,INE422C01014,1/24/2022,BSE,EQ,A,sell,FALSE,2,376.899994,67897100,1.64E+18,2022-01-24T10:34:42
TINPLATE,INE422C01014,1/24/2022,BSE,EQ,A,sell,FALSE,3,376.950012,67896900,1.64E+18,2022-01-24T10:34:42
KHAICHEM,INE745B01028,1/24/2022,NSE,EQ,EQ,sell,FALSE,25,103,52513709,1.20E+15,2022-01-24T10:46:41
TIPSINDLTD,INE716B01011,1/24/2022,BSE,EQ,T,buy,FALSE,1,2136.25,9249400,1.64E+18,2022-01-24T10:48:28
TATAELXSI,INE670A01012,1/24/2022,NSE,EQ,EQ,buy,FALSE,1,6864.149902,78395681,1.30E+15,2022-01-24T10:48:44
IDFCFIRSTB,INE092T01019,1/24/2022,BSE,EQ,A,buy,FALSE,20,45.849998,9840800,1.64E+18,2022-01-24T10:51:24
IEX,INE022Q01020,1/24/2022,NSE,EQ,EQ,buy,FALSE,8,241.300003,27582296,1.10E+15,2022-01-24T10:52:56
CENTURYTEX,INE055A01016,1/24/2022,BSE,EQ,A,buy,FALSE,3,904.950012,3707800,1.64E+18,2022-01-24T10:54:56
ACRYSIL,INE482D01024,1/24/2022,BSE,EQ,A,buy,FALSE,1,781.849976,77503500,1.64E+18,2022-01-24T10:55:27
ACRYSIL,INE482D01024,1/24/2022,BSE,EQ,A,buy,FALSE,2,782.5,77503700,1.64E+18,2022-01-24T10:55:27
IDFCFIRSTB,INE092T01019,1/24/2022,BSE,EQ,A,buy,FALSE,40,45.549999,12408800,1.64E+18,2022-01-24T11:46:16
DEVYANI,INE872J01023,1/25/2022,BSE,EQ,B,buy,FALSE,10,169.649994,2189300,1.64E+18,2022-01-25T11:18:53
WIPRO,INE075A01022,1/25/2022,BSE,EQ,A,buy,FALSE,5,563.5,13799400,1.64E+18,2022-01-25T11:19:16
TIPSINDLTD,INE716B01011,1/25/2022,BSE,EQ,T,buy,FALSE,2,2029.449951,9719700,1.64E+18,2022-01-25T11:19:47
GREAVESCOT,INE224A01026,1/25/2022,BSE,EQ,A,buy,FALSE,1,204.399994,8237600,1.64E+18,2022-01-25T11:19:59
GREAVESCOT,INE224A01026,1/25/2022,BSE,EQ,A,buy,FALSE,29,204.550003,8237900,1.64E+18,2022-01-25T11:19:59
ZOMATO,INE758T01015,1/25/2022,BSE,EQ,B,buy,FALSE,10,97.75,21106000,1.64E+18,2022-01-25T11:20:20
NTPC,INE733E01010,1/27/2022,NSE,EQ,EQ,sell,FALSE,40,134.899994,52123701,1.20E+15,2022-01-27T10:34:27
NLCINDIA,INE589A01014,1/27/2022,BSE,EQ,A,sell,FALSE,50,65.199997,3156900,1.64E+18,2022-01-27T10:34:49
IEX,INE022Q01020,1/27/2022,BSE,EQ,A,buy,FALSE,15,228.5,9225200,1.64E+18,2022-01-27T10:36:21
TRIVENI,INE256C01024,1/27/2022,NSE,EQ,EQ,sell,FALSE,1,260.600006,77952309,1.30E+15,2022-01-27T10:37:42
TRIVENI,INE256C01024,1/27/2022,NSE,EQ,EQ,sell,FALSE,29,260.600006,77952310,1.30E+15,2022-01-27T10:37:42
ACRYSIL,INE482D01024,1/27/2022,NSE,EQ,EQ,buy,FALSE,4,758.650024,1986872,1.00E+15,2022-01-27T10:40:51
KPITTECH,INE04I401011,1/27/2022,BSE,EQ,A,buy,FALSE,5,653.900024,55628100,1.64E+18,2022-01-27T10:41:09
NAZARA,INE418L01021,1/27/2022,NSE,EQ,EQ,buy,FALSE,1,2153.850098,52241910,1.20E+15,2022-01-27T10:43:22
DABUR,INE016A01026,1/28/2022,BSE,EQ,A,buy,FALSE,5,539.900024,2470300,1.64E+18,2022-01-28T09:36:20
NYKAA,INE388Y01029,1/28/2022,NSE,EQ,EQ,buy,FALSE,1,1632,50923608,1.20E+15,2022-01-28T09:39:20
ZENSARTECH,INE520A01027,1/28/2022,BSE,EQ,A,buy,FALSE,1,410.649994,1641400,1.64E+18,2022-01-28T10:02:58
ZOMATO,INE758T01015,1/28/2022,BSE,EQ,B,buy,FALSE,1,90.949997,10178700,1.64E+18,2022-01-28T10:34:45
LT,INE018A01030,1/31/2022,NSE,EQ,EQ,buy,FALSE,2,1890.199951,50016033,1.20E+15,2022-01-31T09:07:32
CDSL,INE736A01011,1/31/2022,NSE,EQ,EQ,buy,FALSE,2,1507,22550,1.00E+15,2022-01-31T09:07:32
INFY,INE009A01021,1/31/2022,NSE,EQ,EQ,buy,FALSE,1,1721.800049,25120412,1.10E+15,2022-01-31T09:15:41
